,ID,url,date_time,text,emoji,user_id,usernameTweet,nbr_reply,nbr_favorite,nbr_retweet,is_reply,is_retweet,sid,searchQuery
62,1239286056144568321,/NelsonIjih/status/1239286056144568321,2020-03-15 16:23:15,"In retrospect, non-Americans should get a negative test results before boarding.

This would have resulted into less flight cancellation and American Airlines not cutting 75% international flights that has affected many Americans & continues to have negative economic effects.",0,981638952250621952,NelsonIjih,0,1,0,0,0,1,American_Airlines
63,1239286070027698177,/Sashypie/status/1239286070027698177,2020-03-15 16:23:18,"This lady at American Airlines saw I was about to lose it and upgraded my seat, gave me a meal voucher, and prayed over me. I have God sent people all around me",Dove of peace,734306822,Sashypie,0,5,0,0,0,1,American_Airlines
64,1239286101778587649,/SelfdrivingC/status/1239286101778587649,2020-03-15 16:23:26,gerald_bader : American Airlines cuts long-haul international flights by 75% via Kirsten Korosec https://ift.tt/2WeIXit #ML #AI #Analytics #Automation pic.twitter.com/FdBYm986XH (via Twitter https://twitter.com/gerald_bader/status/1239272431367393281)pic.twitter.com/c8ZTGh3qKm,0,895331622572183552,SelfdrivingC,0,0,0,0,0,1,American_Airlines
65,1239286421443112962,/DFSgrunt10/status/1239286421443112962,2020-03-15 16:24:42,American Airlines Center @EdmontonOilers vs @DallasStars (March 3rd Trip)pic.twitter.com/3BfHxDyH8w,0,1099324647353401344,DFSgrunt10,0,2,0,0,0,1,American_Airlines
66,1239286560312483840,/Godschosen1A/status/1239286560312483840,2020-03-15 16:25:15,American Airlines to suspend nearly all international flights https://www.nbcnews.com/health/health-news/live-blog/coronavirus-updates-live-americans-fly-home-europe-intensifies-lockdown-n1159296/ncrd1159341 via @NBCNews,0,31214122,Godschosen1A,0,0,2,0,0,1,American_Airlines
67,1239286632810860544,/remu10/status/1239286632810860544,2020-03-15 16:25:32,New post (American Airlines cuts long-haul international flights by 75%) has been published on news204 - https://newsprofixpro.com/news204/2020/03/15/american-airlines-cuts-long-haul-international-flights-by-75/,0,20337236,remu10,0,0,0,0,0,1,American_Airlines
68,1239286915754528770,/BloombergAU/status/1239286915754528770,2020-03-15 16:26:40,American Airlines will slash long-haul international flights by 75% because of the collapse in travel demand https://trib.al/wETrHb4,0,606571099,BloombergAU,0,1,0,0,0,1,American_Airlines
69,1239287240439631872,/leleeeeeet/status/1239287240439631872,2020-03-15 16:27:57,AMERICAN AIRLINES SUSPENDED FLIGHTS TO BRAZIL IM STUCK IN THIS COUNTRY,0,268586440,leleeeeeet,2,12,0,0,0,1,American_Airlines
70,1239287599057027074,/dadams7308/status/1239287599057027074,2020-03-15 16:29:23,American Airlines to suspend nearly all long-haul international flights starting March 16 https://finance.yahoo.com/news/american-airlines-suspend-nearly-long-030100859.html,0,104684802,dadams7308,0,0,0,0,0,1,American_Airlines
71,1239287756687278080,/WJHL11/status/1239287756687278080,2020-03-15 16:30:00,American Airlines announces suspension of international flights related to COVID-19 http://bit.ly/2QfA9Fq,0,66344113,WJHL11,0,1,1,0,0,1,American_Airlines
72,1239287759791165441,/kcautv/status/1239287759791165441,2020-03-15 16:30:01,"On Sunday, the air travel company American Airlines Group, Inc. announced additional schedule changes in response to customer demand related to the novel COVID-19 coronavirus. https://www.siouxlandproud.com/news/american-airlines-announces-suspension-of-international-flights-related-to-covid-19/",0,15651396,kcautv,0,0,0,0,0,1,American_Airlines
73,1239288577680445441,/msail17/status/1239288577680445441,2020-03-15 16:33:16,Seriously you're taking a pic from an Admirals Club...American Airlines Lounge,Face with rolling eyes,473537026,msail17,0,1,1,1,0,1,American_Airlines
74,1239288785277521920,/SophieZo/status/1239288785277521920,2020-03-15 16:34:05,American Airlines cuts long-haul international flights by 75% https://techcrunch.com/2020/03/15/american-airlines-cuts-long-haul-international-flights-by-75/pic.twitter.com/eru7FIZKiA,0,33672294,SophieZo,0,0,0,0,0,1,American_Airlines
75,1239288808044146689,/fredwalton216/status/1239288808044146689,2020-03-15 16:34:11,"FT - American Airlines says it will do just two US flights daily to London, and three weekly flights to Tokyo.

It will continue to do short-haul international flights including to Canada, Mexico, the Caribbean, Central America, and northern areas of South America as scheduled. https://twitter.com/JenniferJJacobs/status/1239262989209014274",0,2567292679,fredwalton216,0,0,0,0,0,1,American_Airlines
76,1239288978848636929,/dwatchnews/status/1239288978848636929,2020-03-15 16:34:52,American Airlines cutting international flights by 75% amid demand collapse http://www.reuters.com/article/us-health-coronavirus-usa-airlines/american-airlines-cutting-international-flights-by-75-amid-demand-collapse-idUSKBN2110YQ,0,449314153,dwatchnews,0,1,1,0,0,1,American_Airlines
77,1239289024579174400,/oreyesmx/status/1239289024579174400,2020-03-15 16:35:02,American Airlines cuts long-haul international flights by 75% http://dlvr.it/RRxVJbpic.twitter.com/GlDfYwbK6d,0,159724677,oreyesmx,0,0,0,0,0,1,American_Airlines
78,1239289027125112832,/Light7Soldier/status/1239289027125112832,2020-03-15 16:35:03,American Airlines cuts long-haul international flights by 75% http://dlvr.it/RRxVKDpic.twitter.com/53k4JLJe5d,0,439942511,Light7Soldier,0,0,0,0,0,1,American_Airlines
79,1239289698150780928,/alpha1010/status/1239289698150780928,2020-03-15 16:37:43,"I called @OvagoCom to cancel my trip for Tuesday (3-17-20) to Europe with AA. To do that they required $300 for ""Ovago Administrative Fee"" to cancel the booking, even though American Airlines is waiving the cancellation fee.
This is price gouging, abusive practice.  Avoid Ovago",0,15538936,alpha1010,1,3,0,0,0,1,American_Airlines
80,1239289787858784267,/felixruizjr0/status/1239289787858784267,2020-03-15 16:38:04,"COVID-19 pandemic forces American Airlines to retire aircraft, offer unpaid employee leave | http://wfaa.com https://twitter.com/intent/user?screen_name=wfaa",0,841796716613492737,felixruizjr0,0,0,0,0,0,1,American_Airlines
81,1239289938098769921,/RealKimHauser/status/1239289938098769921,2020-03-15 16:38:40,My dad got a refund on American Airlines.,0,1852486813,RealKimHauser,0,2,0,1,0,1,American_Airlines
82,1239290195914174464,/stuartpalley/status/1239290195914174464,2020-03-15 16:39:42,"American Airlines is handing out these wipes to passengers on SJD-LAX. Flight attendants making announcement to wash hands, cover sneezes, and dispose of tissues/wipes in special waste container in seat back. Most passengers appear as usual. Some masks. FAs have gloves. pic.twitter.com/QRutLs8PFJ",0,48419856,stuartpalley,2,5,2,0,0,1,American_Airlines
83,1239290310733291521,/lines_aviation/status/1239290310733291521,2020-03-15 16:40:09,"Completing the American trio.

American Airlines A321 taxiing off the runway at Fort Lauderdale international airport. https://ift.tt/3aQ2fPkpic.twitter.com/15d0qblPvQ",0,1046359617289289730,lines_aviation,0,0,0,0,0,1,American_Airlines
84,1239290332619120641,/wernet/status/1239290332619120641,2020-03-15 16:40:14,"Insanity. Absolute insanity.

What part of being cautious yourself in order to protect others do these people not understand.

Perhaps we should crash all American Airlines flights to be fair to those who have died on AA flights before.",0,12626212,wernet,0,0,0,1,0,1,American_Airlines
85,1239290661205094402,/BloombergAsia/status/1239290661205094402,2020-03-15 16:41:33,"Coronavirus Update:
--Europe is reporting more daily cases than China did at its peak
--Add Nike, American Airlines to the list of companies reining back
--Mass Gen hospital calls for ""war-like stance""
https://trib.al/q25MfYz",0,588261604,BloombergAsia,0,3,4,0,0,1,American_Airlines
86,1239291036385439745,/cdemayoWSB/status/1239291036385439745,2020-03-15 16:43:02,American Airlines cuts long-haul international flights by 75% http://dlvr.it/RRxW4bpic.twitter.com/rGddTszYVd,0,1132152481,cdemayoWSB,0,0,1,0,0,1,American_Airlines
87,1239292045782470656,/StepTG/status/1239292045782470656,2020-03-15 16:47:03,American Airlines cuts long-haul international flights by 75% http://dlvr.it/RRxWQ2pic.twitter.com/J2Gh4UOJrm,0,328219505,StepTG,0,0,0,0,0,1,American_Airlines
88,1239292083740921857,/EggDev_/status/1239292083740921857,2020-03-15 16:47:12,Just take a flight on American Airlines! pic.twitter.com/1Q1PMH1uxz,0,982392845616087041,EggDev_,0,1,0,1,0,1,American_Airlines
89,1239292321096781824,/jelloooo1/status/1239292321096781824,2020-03-15 16:48:08,"American Airlines cutting international flights by 75% amid demand collapse

https://youtu.be/jugPmGUF3Co",0,595282438,jelloooo1,0,0,0,0,0,1,American_Airlines
90,1239292443054481408,/seagramsbldg/status/1239292443054481408,2020-03-15 16:48:38,"Thats the American Airlines Admirals Club, Debbie. pic.twitter.com/Pbg9vwaEVF",0,733582418,seagramsbldg,0,13,2,1,0,1,American_Airlines
91,1239293097785294848,/nicolegelinas/status/1239293097785294848,2020-03-15 16:51:14,"e.g., after 9/11, you either bail out the airlines, or you have no American airlines. Not many people criticized that decision. https://twitter.com/nicolegelinas/status/1239291602314702851",0,70742961,nicolegelinas,0,4,2,0,0,1,American_Airlines
92,1239293324458168320,/flylemurs/status/1239293324458168320,2020-03-15 16:52:08,"American Airlines to slash global flights by 75%, Bloomberg reports https://ift.tt/2Wraeyv See the rest of the story here.

http://Theflyonthewall.com provides the latest financial news as it breaks. Known as a leader in market intelligence, The Fly's real-time, streaming news fe",0,633824212,flylemurs,0,0,0,0,0,1,American_Airlines
93,1239293960268414979,/ehatourist/status/1239293960268414979,2020-03-15 16:54:39,American Airlines First Class Boeing A321S Dallas-Fort Worth #DFW to San Francisco #SFO review #travel https://everybodyhatesatourist.net/american-airlines-first-class-boeing-a321s-dallas-fort-worth-dfw-to-san-francisco-sfo-review/?utm_source=ReviveOldPost&utm_medium=social&utm_campaign=ReviveOldPost #airbus #airbusa321 #americanairlines #dallas,0,464206700,ehatourist,0,0,0,0,0,1,American_Airlines
94,1239294084361134081,/Kilsally/status/1239294084361134081,2020-03-15 16:55:09,American Airlines cutting international flights by 75% amid demand collapse | Article [AMP] | Reuters https://www.reuters.com/article/us-health-coronavirus-usa-airlines-idUSKBN2110YQ,0,17019081,Kilsally,0,0,0,0,0,1,American_Airlines
95,1239294103181037569,/menomale_che/status/1239294103181037569,2020-03-15 16:55:13,American Airlines cuts long-haul international flights by 75% https://techcrunch.com/2020/03/15/american-airlines-cuts-long-haul-international-flights-by-75/ via @TechCrunch #TechCrunchpic.twitter.com/InKISuQxUo,0,2737735254,menomale_che,0,0,0,0,0,1,American_Airlines
96,1239294316494778368,/alenoir/status/1239294316494778368,2020-03-15 16:56:04,American Airlines cuts long-haul international flights by 75% http://dlvr.it/RRxX88pic.twitter.com/0zV3Cfztkw,0,17332787,alenoir,0,0,0,0,0,1,American_Airlines
97,1239294321557475329,/Jamescb240752/status/1239294321557475329,2020-03-15 16:56:05,"@LBC  Hi Guys 
I have independently booked 2 return tickets to New York with American airlines 
1st may  return 9thMay.
I have also booked and paid for the weeks accommodation through AirBNB
Do I have a chance of getting my money back. 
I booked with Debit card and also have ins",0,800812822259122178,Jamescb240752,0,0,0,0,0,1,American_Airlines
98,1239294925604184064,/ClassicJerr/status/1239294925604184064,2020-03-15 16:58:29,I cant imagine what its like to be working a call center for an airline or booking site. I called Priceline and American Airlines fri and sat waited 1 hour and got hung up on. Called this morning and got through in 10 minutes. Id be fucking stressed.,0,1144645886556999680,ClassicJerr,0,0,0,0,0,1,American_Airlines
99,1239295247424905216,/HytechUg/status/1239295247424905216,2020-03-15 16:59:46,American Airlines cuts long-haul international flights by 75% | Hytech Lab - https://hytechlab.com/american-airlines-cuts-long-haul-international-flights-by-75/pic.twitter.com/68VjUYupS2,0,3070497022,HytechUg,0,0,0,0,0,1,American_Airlines
0,1213279159499272194,/h_gwater/status/1213279159499272194,2020-01-03 21:01:07," Because were delta airlines,  and life is a fucking nightmare ","Multiple musical notes, Multiple musical notes",2392833047,h_gwater,0,1,0,0,0,1,Delta_Airlines
1,1213299103960043524,/justinisreal/status/1213299103960043524,2020-01-03 22:20:23,"Highlights: 

United Rentals $URI
Synchrony Financial $SYF (currently owned in BRK public equities portfolio  )
Discover $DFS
Southwest Airlines $LUV  
HP $HPQ 
Delta Airlines $DAL  
Valero $VLO 
Capitol One $COF","White heavy check mark, White heavy check mark, White heavy check mark",70018404,justinisreal,1,6,1,0,0,1,Delta_Airlines
2,1213306921790377985,/milliechloe/status/1213306921790377985,2020-01-03 22:51:26,bc were delta airlines and life is a fucking nightmare,0,977427788771790848,milliechloe,0,2,0,0,0,1,Delta_Airlines
3,1213307488189087746,/takeyourmarq/status/1213307488189087746,2020-01-03 22:53:42,"Ill make up some garbage airline, lets say, I dont know, DELTA airlines",0,35123306,takeyourmarq,0,1,0,1,0,1,Delta_Airlines
4,1213316761275322368,/Michael99161326/status/1213316761275322368,2020-01-03 23:30:32,"#Legal: Some flight attendants at Delta Airlines have filed a lawsuit against clothier Lands' End, which designed and supplied uniforms that the attendants claim cause a rash and contribute to a low white blood-cell count.",0,946899362491387904,Michael99161326,0,2,0,0,0,1,Delta_Airlines
5,1213346929213673472,/UnscriptedVices/status/1213346929213673472,2020-01-04 01:30:25,"Tonight #DeathRider Is Gonna Collecting The Championship. He Never Lost 

 Delta Airlines pic.twitter.com/ETDz1JdUFc",Reversed hand with middle finger extended,948025487024185344,UnscriptedVices,0,0,0,0,0,1,Delta_Airlines
6,1213347925943881728,/hashimhaider110/status/1213347925943881728,2020-01-04 01:34:23,An Incredible Jet Engine Barbeque Grill Built by Delta Airlines Techs Using Scrapped Pratt & Whitney Parts https://laughingsquid.com/757-jet-engine-barbecue-grill/,0,228659931,hashimhaider110,0,0,0,0,0,1,Delta_Airlines
7,1213358727522373633,/MedicoCiocolata/status/1213358727522373633,2020-01-04 02:17:18,"Welcome to delta airlines
Where life is a fucking nightmare",0,1162089515579793410,MedicoCiocolata,0,2,1,0,0,1,Delta_Airlines
8,1213366671571853312,/jtravelalerts/status/1213366671571853312,2020-01-04 02:48:52,Roundtrip to ASPEN from EWRfor selected dates in January & February is $311 on Delta Airlines.,0,1212497909268148224,jtravelalerts,0,1,0,0,0,1,Delta_Airlines
9,1213397512352083969,/krishoet/status/1213397512352083969,2020-01-04 04:51:25,"Air France: your flight AF... is operated by Delta you can check in with them

Delta Airlines: you can check in with us but your flight is actually operated by KLM so you can only select your seat with them

KLM: who are you?",0,5442282,krishoet,2,11,0,0,0,1,Delta_Airlines
10,1213399317001592833,/LavenderArtist/status/1213399317001592833,2020-01-04 04:58:35,"And oh, screw you Delta Airlines for taking Mox's belt away from him. #njwk14",0,3387755900,LavenderArtist,0,0,0,0,0,1,Delta_Airlines
11,1213403445904003072,/HighTechAztec/status/1213403445904003072,2020-01-04 05:15:00,Lands' End lawsuit: Hundreds of Delta Airlines workers say uniforms made them sick | Workers who conducted their own tests say mercury and unsafe levels of other chemicals were found in the outfits. https://abc7.com/5810609,0,23045174,HighTechAztec,0,1,0,0,0,1,Delta_Airlines
12,1213405583023337472,/ZacharyClow/status/1213405583023337472,2020-01-04 05:23:29,Fuck delta airlines,0,1143228326548369408,ZacharyClow,0,3,0,0,0,1,Delta_Airlines
13,1213416733081513991,/SCOOTABANDZ/status/1213416733081513991,2020-01-04 06:07:48,TShyst never been on Delta Airlines but my nigga flying ,Baby angel (dark skin tone),296016070,SCOOTABANDZ,0,0,0,0,0,1,Delta_Airlines
14,1213418816128065537,/dfriebis/status/1213418816128065537,2020-01-04 06:16:04,An Incredible Jet Engine Barbeque Grill Built by Delta Airlines Techs Using Scrapped Pratt & Whitney Parts https://laughingsquid.com/757-jet-engine-barbecue-grill/,0,57043383,dfriebis,0,0,0,0,0,1,Delta_Airlines
15,1213429766029807616,/KDnewleadership/status/1213429766029807616,2020-01-04 06:59:35,"#NiceFacilityHereIn_ATL
  feeling thankful at Atlanta International Airport-Delta Airlines https://www.facebook.com/11507736/posts/10104808070569946/",Breastfeeding (medium skin tone),38971323,KDnewleadership,0,1,0,0,0,1,Delta_Airlines
16,1213436887248949249,/sureshv999/status/1213436887248949249,2020-01-04 07:27:53,@Delta I'm trying to contact Delta airlines through phone from India. Could you please provide me a 24/7 costumer service number.,0,73028819,sureshv999,0,0,0,0,0,1,Delta_Airlines
17,1213439052223012865,/Useless_PhD/status/1213439052223012865,2020-01-04 07:36:29,Unlike Delta Airlines who charged me extortionate amount to check in my baggage. Never again.,0,741294150386130944,Useless_PhD,0,0,0,1,0,1,Delta_Airlines
18,1213444451797884928,/Jkempy16/status/1213444451797884928,2020-01-04 07:57:56,Be right back #houstonyouhaveaproblem #letsgobuffalo #playofffootball next stop nrg stadium @ Atlanta International Airport-Delta Airlines https://www.instagram.com/p/B65ggkxAQGnGwPskYaiFF7iRXjFdj_FUT5OMOI0/?igshid=1icuesljaodkc,0,121233773,Jkempy16,1,0,1,0,0,1,Delta_Airlines
19,1213452795145281538,/joedph2/status/1213452795145281538,2020-01-04 08:31:05,@Delta Hey Delta Airlines!  There is a declared State of Emergency in Australia NSW.  I cancelled my flight yesterday and had to pay a fee!  What does it take for Delta to wake up!  When air clears Ill book elsewhere!,0,1177752238304956418,joedph2,1,0,0,0,0,1,Delta_Airlines
20,1213459583525482502,/rfrugalfashion/status/1213459583525482502,2020-01-04 08:58:04,"Delta Airlines suing Lands End 
donations welcomed @ http://tinyurl.com/fmfdonat3https://www.reddit.com/r/frugalmalefashion/comments/ejwwu8/delta_airlines_suing_lands_end/",0,1082469427034157056,rfrugalfashion,0,0,0,0,0,1,Delta_Airlines
21,1213471269812723714,/karkatheadrest/status/1213471269812723714,2020-01-04 09:44:30,W'ERE DELTA AIRLINES AND L I F E I S A F U C K I N . G N I G H T M A R E,0,1182252521835728896,karkatheadrest,0,6,0,0,0,1,Delta_Airlines
22,1213475184033714176,/1055WDUV/status/1213475184033714176,2020-01-04 10:00:03,"Can what you wear make you sick? Some Delta Airlines employees say yes. 

#DeltaAirlines #LandsEnd #lawsuit #healthissues #chemicals #heavymetals

http://bit.ly/35qErOKpic.twitter.com/QZTn9byye9",0,608235166,1055WDUV,0,0,1,0,0,1,Delta_Airlines
23,1213493794743734275,/J_TiX/status/1213493794743734275,2020-01-04 11:14:00,Is there anyone here that works for Delta Airlines?,0,31347317,J_TiX,0,0,0,0,0,1,Delta_Airlines
24,1213498962969350144,/theusposts1/status/1213498962969350144,2020-01-04 11:34:33,"Delta airlines new uniforms giving workers boils, rashes, hair loss and other healthissues https://theusposts.com/delta-airlines-new-uniforms-giving-workers-boils-rashes-hair-loss-and-other-health-issues/pic.twitter.com/WoeewctYPs",0,1189446623522414592,theusposts1,0,0,0,0,0,1,Delta_Airlines
25,1213500933889560578,/UazmiWorld/status/1213500933889560578,2020-01-04 11:42:23,"Delta airlines new uniforms giving workers boils, rashes, hair loss and other health issues.

 #news

HUNDREDS of Delta workers have filed lawsuits against the maker of their uniforms which they say are causing serious...https://uazmi.com/news/post/hGcrPZyXXM6NdO4qHBrm4A",Red circle,1181522455552303105,UazmiWorld,0,0,0,0,0,1,Delta_Airlines
26,1213502245721067520,/KuterAnn/status/1213502245721067520,2020-01-04 11:47:35,Tell Delta Airlines To STOP Their Discriminating Service Dog Policy http://chng.it/sS7N9n8z via @Change,0,822203199461281792,KuterAnn,0,0,0,0,0,1,Delta_Airlines
27,1213505484235386887,/AIRPLANESHOP/status/1213505484235386887,2020-01-04 12:00:27," Featured Item! 
RT4991
DaronWWT Delta Airlines Playset
Price: $17.95
Link here: http://ow.ly/2zpc50xMSHv *Mat not included
Item HE530262
Link: http://ow.ly/xtUl50uWVajpic.twitter.com/66UJjJhSDm","Airplane, Airplane",24732369,AIRPLANESHOP,0,3,0,0,0,1,Delta_Airlines
28,1213516953681383426,/Flyingpatsfan12/status/1213516953681383426,2020-01-04 12:46:02,An Incredible Jet Engine Barbeque Grill Built by Delta Airlines Techs Using Scrapped Pratt & Whitney Parts https://laughingsquid.com/757-jet-engine-barbecue-grill/ via @LaughingSquid,0,766615113742909440,Flyingpatsfan12,0,1,0,0,0,1,Delta_Airlines
29,1213520676423979009,/MensClothingTip/status/1213520676423979009,2020-01-04 13:00:50,Delta airlines suing Lands End https://www.reddit.com/r/malefashionadvice/comments/ejxyfl/delta_airlines_suing_lands_end/,0,1193587891,MensClothingTip,0,0,0,0,0,1,Delta_Airlines
30,1213522081868062720,/TheSun_NI/status/1213522081868062720,2020-01-04 13:06:25,"Delta airlines' new uniforms 'giving workers boils, rashes, hair loss and other health issues https://www.thesun.ie/news/4952193/delta-airlines-new-uniforms-giving-workers-boils-rashes-hair-loss-and-other-health-issues/?utm_term=Autofeed&utm_medium=Social&utm_source=Twitter#Echobox=1578161117",0,1269447511,TheSun_NI,0,2,0,0,0,1,Delta_Airlines
31,1213532154141069312,/Michael_Haz/status/1213532154141069312,2020-01-04 13:46:26,"So long Lands' End.  It was nice knowing ya back when your clothing was good quality.

500+ Delta Airlines employees suing Lands End over toxic and carcinogenic chemicals in Delta uniforms provided by Lands' End

http://bit.ly/2tvJ6BE",0,18602254,Michael_Haz,0,0,1,0,0,1,Delta_Airlines
32,1213540641201897472,/blocktimusprime/status/1213540641201897472,2020-01-04 14:20:10,I may be wrong but don't a lot of these soldiers take like Delta Airlines to get to war?,0,869745302,blocktimusprime,0,0,0,1,0,1,Delta_Airlines
33,1213551435805286400,/harry1000000/status/1213551435805286400,2020-01-04 15:03:03,An Incredible Jet Engine Barbeque Grill Built by Delta Airlines Techs Using Scrapped Pratt & Whitney Parts https://laughingsquid.com/757-jet-engine-barbecue-grill/,0,201314226,harry1000000,0,0,0,0,0,1,Delta_Airlines
34,1213552222799376390,/Iovablegf/status/1213552222799376390,2020-01-04 15:06:11,were delta airlines and lifes a fucking nightmare,0,767904168799600640,Iovablegf,0,1,1,0,0,1,Delta_Airlines
35,1213565370063314944,/DoreneLorenz/status/1213565370063314944,2020-01-04 15:58:25,An Incredible Jet Engine Barbeque Grill Built by Delta Airlines Techs Using Scrapped Pratt & Whitney Parts https://laughingsquid.com/757-jet-engine-barbecue-grill/,0,249826268,DoreneLorenz,0,0,0,0,0,1,Delta_Airlines
36,1213585525170429958,/bengyclayton/status/1213585525170429958,2020-01-04 17:18:31,As Delta airlines says..we dont pull out on time!....Godspeed and enjoy the rides!,0,817514013881929730,bengyclayton,1,2,0,1,0,1,Delta_Airlines
37,1213585715126251521,/BobBlackburn/status/1213585715126251521,2020-01-04 17:19:16,An Incredible Jet Engine Barbeque Grill Built by Delta Airlines Techs Using Scrapped Pratt & Whitney Parts https://laughingsquid.com/757-jet-engine-barbecue-grill/,0,15636240,BobBlackburn,0,0,0,0,0,1,Delta_Airlines
38,1213588286637129728,/seanmortega/status/1213588286637129728,2020-01-04 17:29:29,"The flights were on #Delta and everything about both flights was wonderful.  Thank you so much, Delta Airlines!",0,734877479316426753,seanmortega,1,0,0,0,0,1,Delta_Airlines
39,1213591630445469696,/pamillman/status/1213591630445469696,2020-01-04 17:42:46,"Ed Bastian at Delta Airlines. Company in bad shape when he arrived. Arnold Donald, CEO of Carnival Cruises oversees a floating country in a world increasingly concerned about fossil fuels, plastic waste, over-tourism in places like Venice, where big ships regularly put to port.",0,346067121,pamillman,0,3,0,1,0,1,Delta_Airlines
40,1213594817533480966,/HipChickComics/status/1213594817533480966,2020-01-04 17:55:26,An Incredible Jet Engine Barbeque Grill Built by Delta Airlines Techs Using Scrapped Pratt & Whitney Parts https://laughingsquid.com/757-jet-engine-barbecue-grill/,0,103230802,HipChickComics,0,0,0,0,0,1,Delta_Airlines
41,1213594931337613312,/Scoob_Dahustla/status/1213594931337613312,2020-01-04 17:55:53,It was alright Ocean City better if u ask me ... @ Atlanta International Airport-Delta Airlines https://www.instagram.com/p/B66k8Hslf44rndETJhFns9XJncWB30C3lz5XLY0/?igshid=134bk2egs2mb4,Man shrugging (medium dark skin tone),530860402,Scoob_Dahustla,0,0,0,0,0,1,Delta_Airlines
42,1213596165079535616,/IrishSunOnline/status/1213596165079535616,2020-01-04 18:00:47,"Delta airlines' new uniforms 'giving workers boils, rashes, hair loss and other health issues https://www.thesun.ie/news/4952193/delta-airlines-new-uniforms-giving-workers-boils-rashes-hair-loss-and-other-health-issues/?utm_medium=Social&utm_source=Twitter#Echobox=1578165755",0,517607733,IrishSunOnline,0,0,0,0,0,1,Delta_Airlines
43,1213600926369558528,/PrInCEss11ism/status/1213600926369558528,2020-01-04 18:19:43,Just posted a photo @ Atlanta International Airport-Delta Airlines https://www.instagram.com/p/B66nqvOFrFL/?igshid=1fq4h7rsf1dkz,0,46510433,PrInCEss11ism,0,0,0,0,0,1,Delta_Airlines
44,1213609305112379392,/dooleydooley/status/1213609305112379392,2020-01-04 18:53:00,Highlands its been awesome. We love you forever!!! See you next time!!  Texas were on our way!!! @ Atlanta International Airport-Delta Airlines https://www.instagram.com/p/B66reaapuSU/?igshid=14je76f3jd0b6,0,22204218,dooleydooley,0,3,0,0,0,1,Delta_Airlines
45,1213616514143797253,/xosimeko/status/1213616514143797253,2020-01-04 19:21:39,Delta airlines is not dropping nobody off in Iraq,0,442364882,xosimeko,1,2,0,0,0,1,Delta_Airlines
