,ID,url,date_time,text,emoji,user_id,usernameTweet,nbr_reply,nbr_favorite,nbr_retweet,is_reply,is_retweet,sid,searchQuery
14,1212457368191152128,/CaliBelleShi/status/1212457368191152128,2020-01-01 14:35:37,"Frontier airlines got some flights 99% off. Today only. For like now to 3/5. 

I wonder if theyre worse than spirit.",0,2754697174,CaliBelleShi,1,0,0,0,0,1,Frontier_Airlines
15,1212461582862749696,/FrontierCare/status/1212461582862749696,2020-01-01 14:52:22,"Hello, thank you for reaching out to Frontier Airlines. I do apologize for your recent experience. Will you please follow us and then DM us your 6 digit reservation code so we can look further into this for you? ^VT",0,179568369,FrontierCare,0,0,0,1,0,1,Frontier_Airlines
16,1212463726722506758,/FrontierCare/status/1212463726722506758,2020-01-01 15:00:53,"Hello, thank you for reaching out to Frontier Airlines. Can you follow us then DM us your 6 digit reservation code so we can look further into this for you? ^VT",0,179568369,FrontierCare,0,0,0,1,0,1,Frontier_Airlines
17,1212464647661477888,/technology_2021/status/1212464647661477888,2020-01-01 15:04:33,This Frontier Airlines sale is your chance to book a flight for a whopping 99% off http://dlvr.it/RMGgmN #MobilePhonespic.twitter.com/ptSgG3JQ3G,0,169047699,technology_2021,0,0,0,0,0,1,Frontier_Airlines
18,1212477217781010432,/nswint/status/1212477217781010432,2020-01-01 15:54:30,This Frontier Airlines sale is your chance to book a flight for a whopping 99% off https://goo.gl/fb/x8Wv5Q,0,15613363,nswint,0,0,0,0,0,1,Frontier_Airlines
19,1212482256301953024,/FrontierCare/status/1212482256301953024,2020-01-01 16:14:31,"Hello, thank you for reaching out to Frontier Airlines. Yes, the voucher could be used for a May flight. You do not have to fly by the date your voucher expires your flight just has to be booked by that date. ^VT",0,179568369,FrontierCare,0,1,0,1,0,1,Frontier_Airlines
20,1212503421368053761,/FrontierCare/status/1212503421368053761,2020-01-01 17:38:37,"Hello, thank you for reaching out to Frontier Airlines. I do apologize for the recent experience. Can you please follow us and then DM us your 6 digit reservation code so we can look further into this for you? ^VT",0,179568369,FrontierCare,0,0,0,1,0,1,Frontier_Airlines
21,1212505160435388416,/Droid_News/status/1212505160435388416,2020-01-01 17:45:32,This Frontier Airlines sale is your chance to book a flight for a whopping 99% off http://bit.ly/2QgrCCw,0,85002295,Droid_News,0,0,0,0,0,1,Frontier_Airlines
22,1212506193618452480,/FrontierCare/status/1212506193618452480,2020-01-01 17:49:38,"Hello, thank you for reaching out to Frontier Airlines. I do apologize for the recent experience. Will you please follow us and then DM us your 6 digit reservation code so we can look further into it for you? ^VT",0,179568369,FrontierCare,0,0,0,1,0,1,Frontier_Airlines
23,1212513844158963713,/alt_brainnews/status/1212513844158963713,2020-01-01 18:20:02,Two passengers say Frontier Airlines staff ignored requests probe into Trump EPA threat to FBI's Internal Investigators.,0,964958062686756869,alt_brainnews,0,0,0,0,0,1,Frontier_Airlines
24,1212518188069638145,/FrontierCare/status/1212518188069638145,2020-01-01 18:37:18,"Hello, thank you for reaching out to Frontier Airlines. I do apologize for the recent experience. Will you please follow us and then DM us your 6 digit reservation code so we can further assist you. ^VT",0,179568369,FrontierCare,1,0,0,1,0,1,Frontier_Airlines
25,1212519159134932992,/FrontierCare/status/1212519159134932992,2020-01-01 18:41:09,"Hello, thank you for reaching out to Frontier Airlines. I do apologize for the delay in our response to you. Please follow us and then DM us your 6 digit reservation code so we can look further into this for you. ^VT",0,179568369,FrontierCare,1,0,0,1,0,1,Frontier_Airlines
26,1212520470068760576,/jemichael68/status/1212520470068760576,2020-01-01 18:46:22,That Denver direct flight hub for Frontier airlines though.,0,2854117161,jemichael68,0,0,0,1,0,1,Frontier_Airlines
27,1212521220299730944,/FrontierCare/status/1212521220299730944,2020-01-01 18:49:21,"Hello, thank you for reaching out to Frontier Airlines. I do apologize for the recent experience. Will you please follow us and then DM us your 6 digit reservation code so we can look further into this for you? ^VT",0,179568369,FrontierCare,1,1,0,1,0,1,Frontier_Airlines
28,1212524917587087360,/FrontierCare/status/1212524917587087360,2020-01-01 19:04:02,"Hello, thank you for reaching out to Frontier Airlines. I do apologize for the recent experience. Will you please follow us and then DM us your 6 digit reservation code so we can look further into this for you? ^VT",0,179568369,FrontierCare,0,0,0,1,0,1,Frontier_Airlines
29,1212542791194157056,/SummerFF1/status/1212542791194157056,2020-01-01 20:15:04,New Year Sale - 99% off Frontier Airlines @Airfarewatchdog https://www.extrabux.com/en/deals/4015290,0,1065943967638917120,SummerFF1,1,0,0,0,0,1,Frontier_Airlines
30,1212547577247191043,/schofield_katy/status/1212547577247191043,2020-01-01 20:34:05,"Peeps who want to go to WDW but are on a budget-
Frontier Airlines is having a pretty rad sale, only going on for the next two hours!
Use promo code NEWYEAR (only on One-Way bookings)

Cheapest route I found was from Ontario to Orlando for 36$!",0,824788193287417856,schofield_katy,1,11,0,0,0,1,Frontier_Airlines
31,1212553793155600384,/mallorycchan/status/1212553793155600384,2020-01-01 20:58:47,Has anyone flown Frontier Airlines before? @FlyFrontier,0,919570033461907456,mallorycchan,0,0,0,0,0,1,Frontier_Airlines
32,1212557701294759942,/doc_mbreezee/status/1212557701294759942,2020-01-01 21:14:18,Women Sue Frontier Airlines For Failing To Help Following Alleged Sexual Assault - TravelNoire https://travelnoire.com/frontier-airlines-sexual-assault,0,30240345,doc_mbreezee,0,0,0,0,0,1,Frontier_Airlines
33,1212565110281031686,/ZakBabyTV/status/1212565110281031686,2020-01-01 21:43:45,Anyone flied a redeye? Scary? Anyone flown on Frontier Airlines???,0,927027680662339584,ZakBabyTV,2,1,0,0,0,1,Frontier_Airlines
34,1212591288631074817,/emerpusdroltihs/status/1212591288631074817,2020-01-01 23:27:46,Love flying Frontier Airlines to get treated like the dumb piece of shit I am,0,3461564117,emerpusdroltihs,1,3,0,0,0,1,Frontier_Airlines
35,1212624078038691840,/ijournal/status/1212624078038691840,2020-01-02 01:38:04,Women Sue Frontier Airlines in Colorado Over Sex Assaults by Passengers http://bit.ly/2QgWUJm,0,15300677,ijournal,0,1,0,0,0,1,Frontier_Airlines
36,1212626615701651459,/Covensure/status/1212626615701651459,2020-01-02 01:48:09,Women Sue Frontier Airlines in Colorado Over Sex Assaults by Passengers http://dlvr.it/RMHZ24pic.twitter.com/H9ifaFgC2r,0,772667836384874496,Covensure,0,0,0,0,0,1,Frontier_Airlines
37,1212629122754715648,/InsureStyle/status/1212629122754715648,2020-01-02 01:58:07,Women Sue Frontier Airlines in Colorado Over Sex Assaults by Passengers https://ift.tt/2QdSpPE,0,1172422544139251712,InsureStyle,0,0,0,0,0,1,Frontier_Airlines
38,1212644546372362241,/mdrtindia/status/1212644546372362241,2020-01-02 02:59:24,Women Sue Frontier Airlines in Colorado Over Sex Assaults by Passengers https://goo.gl/fb/54en7c #insurance,0,65236628,mdrtindia,0,0,0,0,0,1,Frontier_Airlines
39,1212648793621090304,/kotaknaren/status/1212648793621090304,2020-01-02 03:16:16,RT @mdrtindia: Women Sue Frontier Airlines in Colorado Over Sex Assaults by Passengers https://goo.gl/fb/54en7c #insurance,0,122154024,kotaknaren,0,0,0,0,0,1,Frontier_Airlines
40,1212700960029642754,/kuyacv/status/1212700960029642754,2020-01-02 06:43:34,frontier airlines is for crackheads and i found that out the hard way.,0,738245781023383552,kuyacv,1,10,2,0,0,1,Frontier_Airlines
41,1212709789719048193,/Ryan_Anloague/status/1212709789719048193,2020-01-02 07:18:39,"Traveling to Boston and flying Frontier for the first time. I already thought of a new tag line for them:

Frontier Airlines. Its basically a bus with wings. pic.twitter.com/LlcTpXBtuR  at Orlando International Airport (MCO)",0,838441790,Ryan_Anloague,0,8,0,0,0,1,Frontier_Airlines
42,1212723087348682754,/tmj_mia_jobs/status/1212723087348682754,2020-01-02 08:11:29,"Now hiring for 1393 job opportunities at UPS (@DanieAtUPSjobs), MarineMax (@MarineMax_Jobs), Frontier Airlines (@FlyFrontierJobs), and more.",0,38081969,tmj_mia_jobs,0,0,0,0,0,1,Frontier_Airlines
43,1212754907368837122,/tmj_DEN_skltrd/status/1212754907368837122,2020-01-02 10:17:56,"Looking to join Kelly Services, EmployBridge (@RemedyStaffing), or Frontier Airlines (@FlyFrontierJobs)? View 26 openings from these companies and more.",0,118210278,tmj_DEN_skltrd,0,0,0,0,0,1,Frontier_Airlines
44,1212761225324462081,/IsabelSala2/status/1212761225324462081,2020-01-02 10:43:02,Why fly Delta? I avoid Delta and Frontier airlines.,0,822673879072022529,IsabelSala2,0,0,0,1,0,1,Frontier_Airlines
45,1212761754368761857,/paulinar___2017/status/1212761754368761857,2020-01-02 10:45:08,Frontier airlines,0,2714894527,paulinar___2017,0,1,0,1,0,1,Frontier_Airlines
46,1212768963962318848,/asili000/status/1212768963962318848,2020-01-02 11:13:47,"Never ever fly Frontier Airlines! Delayed and@canceled flights. No customer service. Even the employees told passengers, Dont fly us, we suck.
#neverFronteir",0,798560995,asili000,0,1,0,0,0,1,Frontier_Airlines
47,1212769147756695553,/nica1327/status/1212769147756695553,2020-01-02 11:14:31,Frontier Airlines the Worst airline in the world.. horrible customer service. Im going to fill a lawsuit for the way they treat us.. they messed around with the wrong person..,0,83601318,nica1327,0,0,0,1,0,1,Frontier_Airlines
48,1212774145450291200,/MacombAdjuster/status/1212774145450291200,2020-01-02 11:34:23,Women Sue Frontier Airlines in Colorado Over Sex Assaults by Passengers https://www.insurancejournal.com/news/west/2020/01/02/553210.htm,0,913930988278898688,MacombAdjuster,0,0,0,0,0,1,Frontier_Airlines
49,1212786662276816896,/asili000/status/1212786662276816896,2020-01-02 12:24:07,"@FlyFrontier Never ever fly Frontier Airlines! Delayed and@canceled flights. No customer service. Even the employees told passengers, Dont fly us, we suck.
#neverFrontier",0,798560995,asili000,0,0,0,0,0,1,Frontier_Airlines
50,1212794616933687297,/saveplantravel/status/1212794616933687297,2020-01-02 12:55:43,"Hartford (BDL) Miami (MIA)
Travel Dates: 2/6/20 to 2/13/20
$75 RT NONSTOP 
Book on Frontier Airlines 
Carry-on NOT included!",0,1106341935101419520,saveplantravel,0,2,0,0,0,1,Frontier_Airlines
51,1212804323404582912,/StandUpDave/status/1212804323404582912,2020-01-02 13:34:18,Just flew Frontier Airlines. I dont know about the slogan The only thing a that stops a bad guy with a gun is a good guy with a gun... Frontier Airlines! but I did make it home safely.,0,19052667,StandUpDave,0,1,0,0,0,1,Frontier_Airlines
52,1212832108303060992,/AmarahBeeUnCut/status/1212832108303060992,2020-01-02 15:24:42,Has anyone flown on Frontier Airlines.,0,1932503982,AmarahBeeUnCut,4,0,0,0,0,1,Frontier_Airlines
53,1212847878697181184,/keetokins/status/1212847878697181184,2020-01-02 16:27:22,Frontier airlines,0,830096738,keetokins,0,0,0,1,0,1,Frontier_Airlines
54,1212869841583058944,/FrontierCare/status/1212869841583058944,2020-01-02 17:54:38,"Hello, thank you for reaching out to Frontier Airlines. I do apologize for your recent experience. Please follow us and then DM us your 6 digit reservation code so we can look further into this for you. ^VT",0,179568369,FrontierCare,1,0,0,1,0,1,Frontier_Airlines
55,1212923014662283264,/hanksmom123321/status/1212923014662283264,2020-01-02 21:25:56,"Transferred to Frontier Airlines ""Discount Den Special Section"" four times in last 45 minutes and cut off every time. WTF??!! Website sucks, voicemail sucks, customer service sucks.",0,761186213067763712,hanksmom123321,0,1,0,0,0,1,Frontier_Airlines
56,1212946275986837504,/cjnotcregg/status/1212946275986837504,2020-01-02 22:58:22,"My grandpa teared up when he dropped me off at the airport and Im not sure Ill ever emotionally recover 
also if there are now videos online of me sobbing in a frontier airlines line, it was not because of their insane baggage rules but WAS because of THIS",Skull,1089382166268600321,cjnotcregg,0,3,0,0,0,1,Frontier_Airlines
57,1212965561057136641,/BRY0NCE/status/1212965561057136641,2020-01-03 00:15:00,Ok but Im also considering the fact that Frontier Airlines will probably k*ll me before any war. So now what.,0,137051134,BRY0NCE,1,1,0,1,0,1,Frontier_Airlines
58,1213011633028493312,/Mireille_Laure/status/1213011633028493312,2020-01-03 03:18:04,Public service announcement. Frontier Airlines is some shit. Pay the extra money and go with American... or literally any other airline.,0,455330479,Mireille_Laure,0,0,0,0,0,1,Frontier_Airlines
59,1213048130549080064,/Chatterbox_mike/status/1213048130549080064,2020-01-03 05:43:06,Who has used frontier airlines before? How bad are they?,0,351544594,Chatterbox_mike,0,0,0,0,0,1,Frontier_Airlines
60,1213073599927443457,/parvezriyaz1/status/1213073599927443457,2020-01-03 07:24:18,"https://airlinescontactnumber.net/frontier/
Easy to book flight ticket with Frontier Airlines  reservataions. pic.twitter.com/N3fXsVIlH4",0,1176459627271081986,parvezriyaz1,0,0,0,0,0,1,Frontier_Airlines
61,1213088888341827585,/stacyknows/status/1213088888341827585,2020-01-03 08:25:03,Save 90% or 75% Off on Your One Way Flight at Frontier Airlines. Expires 1/4/2020. https://dealspotr.com/deal/-ds-90-off-on-your-next-flight-at-frontier-airlines?join=stacyknows #thatsdarling via @dealspotr,0,16558413,stacyknows,0,0,0,0,0,1,Frontier_Airlines
62,1213110663222091776,/tinacharisma007/status/1213110663222091776,2020-01-03 09:51:35,"75% or 90% Off Your Next Frontier Flight, Frontier Airlines - DealsPlus - https://go.shr.lc/39DnLqv via @DealsPlus",0,3060315916,tinacharisma007,0,0,0,0,0,1,Frontier_Airlines
63,1213111668085022720,/shinrinyoku10/status/1213111668085022720,2020-01-03 09:55:34,@Frontierair1 Frontier Airlines just denied a refund to the parents of an 11 week old infant who in heart failure a refund because the infant who is sick is not a ticketed passenger. #frontierairlineshasnocompassion,0,1125685843342123008,shinrinyoku10,0,0,0,0,0,1,Frontier_Airlines
64,1213115076888190976,/shinrinyoku10/status/1213115076888190976,2020-01-03 10:09:07,"@FlyFrontier
Frontier Airlines just denied a refund to the parents of an 11 week old infant who in heart failure a refund because the infant who is sick is not a ticketed passenger.",0,1125685843342123008,shinrinyoku10,0,0,0,0,0,1,Frontier_Airlines
65,1213116620010340356,/FlyFrontier/status/1213116620010340356,2020-01-03 10:15:15,Join the Frontier Airlines team thats responsible for making a great first impression as an Aircraft Appearance Agent! We are one of the fastest growing airlines and we would love for you to join the Frontier family! http://bit.ly/2rMNyeUpic.twitter.com/Y789zNYvLF,0,14172570,FlyFrontier,5,23,7,0,0,1,Frontier_Airlines
66,1213117945250869249,/tmj_cob_acct1/status/1213117945250869249,2020-01-03 10:20:31,"Check out the 78 latest openings at Kelly Services, Johns Manville (@JM_Jobs), Frontier Airlines (@FlyFrontierJobs), and more.",0,22030968,tmj_cob_acct1,0,0,0,0,0,1,Frontier_Airlines
67,1213125761780961281,/tmj_cob_it/status/1213125761780961281,2020-01-03 10:51:35,"Check out the 72 latest openings at Cognizant (@USJobsCognizant), Frontier Airlines (@FlyFrontierJobs), Centura Health (@centurahealth), and more.",0,62370280,tmj_cob_it,0,0,0,0,0,1,Frontier_Airlines
68,1213140790710542337,/DubyaSquar3d/status/1213140790710542337,2020-01-03 11:51:18,"Should be put on a ""no-flight"" list temporarily, just like any passenger who exhibits selfish, disgusting behavior on airplanes. At least for major airlines, let them all fly Frontier airlines together.",0,1009120532,DubyaSquar3d,1,3,0,1,0,1,Frontier_Airlines
69,1213146193011843072,/randbtravel/status/1213146193011843072,2020-01-03 12:12:46,A Big Dominican Republic Expansion for Frontier Airlines https://www.caribjournal.com/2020/01/02/dominican-republic-frontier-airlines-expansion/,0,211285631,randbtravel,0,0,1,0,0,1,Frontier_Airlines
70,1213150531771883520,/gmason1214/status/1213150531771883520,2020-01-03 12:30:00,Since Orlando is now the busiest airport in Florida and had over 50 million people....Frontier Airlines marked a major milestone of investment in Orlando. https://lnkd.in/eZ6xu-a,0,1584441392,gmason1214,0,0,0,0,0,1,Frontier_Airlines
71,1213158391469744128,/FlyBranson/status/1213158391469744128,2020-01-03 13:01:14,"Frontier Airlines Low Fares Done Right  NOW BOOKING. 

There are many fun spring and summer activities right here in Branson! Take a stroll around historic Downtown Branson and Branson Landing!

Now Booking at http://FlyBranson.com! Nonstop Service Starts April 23, 2020!pic.twitter.com/YUdm9k39ax",0,16655623,FlyBranson,0,2,1,0,0,1,Frontier_Airlines
72,1213196145364783111,/The_Miles_Man/status/1213196145364783111,2020-01-03 15:31:15,Using Amex Platinum airline credits on Frontier Airlines https://themilesman.com/blog/f/using-amex-platinum-airline-credits-on-frontier-airlines via @the_miles_man #frequentflier #miles #points #airline,0,1184579710807957506,The_Miles_Man,0,0,1,0,0,1,Frontier_Airlines
73,1213197817432465408,/charusurimusic/status/1213197817432465408,2020-01-03 15:37:54,I saw frontier airlines from Trenton to key west/ Miami for as low as $78 round trip. Trenton tho! But still.,0,15386532,charusurimusic,1,1,0,1,0,1,Frontier_Airlines
74,1213206866911793152,/Ddamesek/status/1213206866911793152,2020-01-03 16:13:52,"Frontier Airlines is the worst airline ever!!  @FlyFrontier you should be ashamed of yourselves!!!  You lost my luggage, told me to replace what I need and submit my receipts, and now you will not respond to me!  You obviously dont care about your customers!!",0,2330796595,Ddamesek,2,1,2,0,0,1,Frontier_Airlines
75,1213245509403598849,/nolacaribe/status/1213245509403598849,2020-01-03 18:47:25,A Big Dominican Republic Expansion for Frontier Airlines https://www.caribjournal.com/2020/01/02/dominican-republic-frontier-airlines-expansion/,0,85952462,nolacaribe,0,0,1,0,0,1,Frontier_Airlines
76,1213265284288659456,/KDVR/status/1213265284288659456,2020-01-03 20:05:59,Denver police arrested a man they say sent threatening text messages while on a Frontier Airlines flight Thursday. https://kdvr.com/2020/01/03/passenger-arrested-at-dia-for-making-disturbing-comments-sending-threatening-texts/?taid=5e0fe4f748fe970001449efa&utm_campaign=trueAnthem%3A+Trending+Content&utm_medium=trueAnthem&utm_source=twitter,0,18777618,KDVR,0,0,0,0,0,1,Frontier_Airlines
77,1213280000750698496,/lio_miller/status/1213280000750698496,2020-01-03 21:04:28,Shout out to frontier airlines for breaking my walker twice,0,801244319801753600,lio_miller,1,1,0,0,0,1,Frontier_Airlines
78,1213325839380754433,/BadTime_FG/status/1213325839380754433,2020-01-04 00:06:37,Frontier airlines $60 pull up brodie https://twitter.com/Blizzzayyy/status/1213325622124122112,0,258597811,BadTime_FG,0,0,0,0,0,1,Frontier_Airlines
79,1213334007603220480,/12News/status/1213334007603220480,2020-01-04 00:39:04,"Richard Porter was aboard a Frontier Airlines flight preparing to depart when another passenger became concerned about his statements, DPD said. https://www.12news.com/article/news/crime/frontier-flight-passenger-arrested-denver-international-airport/73-12631930-b1be-4786-b142-3e3fb0c7c3ba",0,17187236,12News,0,3,3,0,0,1,Frontier_Airlines
80,1213375666462306304,/Jim_Udder/status/1213375666462306304,2020-01-04 03:24:36,"Also the Frontier Airlines red-eye from Las Vegas to Charlotte is, um, uh, quite eclectic as a travel experience.  I'm not so sure everything stayed in Vegas with that lot.",0,1633979000,Jim_Udder,0,3,0,0,0,1,Frontier_Airlines
81,1213443765957877760,/shivani64151826/status/1213443765957877760,2020-01-04 07:55:13,"Frontier Airlines Customer Service +1-855-653-0624, Nevada, USA | Get help
https://www.tripexel.com/flights/customer-service/frontier-airlines/
Here Frontier Airlines are providing the best deal offer to our passengers.",0,1192002965973827584,shivani64151826,0,0,0,0,0,1,Frontier_Airlines
82,1213466751133859840,/tmj_apa_jobs/status/1213466751133859840,2020-01-04 09:26:33,"Now hiring for 3010 job opportunities at CVS Health (@CVSHealthJobs), Frontier Airlines (@FlyFrontierJobs), Barnes & Noble (@BNCareers), and more.",0,2573310127,tmj_apa_jobs,0,0,0,0,0,1,Frontier_Airlines
83,1213499814089854976,/BullyWasHere/status/1213499814089854976,2020-01-04 11:37:56,I've read the horror stories about Spirit and Frontier airlines but I've never had a problem with em,0,1638439856,BullyWasHere,0,0,0,0,0,1,Frontier_Airlines
84,1213518206444412928,/CassandraCohan/status/1213518206444412928,2020-01-04 12:51:01,I cant believe Havi got me so excited for our vacation just to tell me were flying frontier airlines at 6 am.,0,773711528398848000,CassandraCohan,1,6,0,0,0,1,Frontier_Airlines
85,1213557243980812288,/AkhilSwami2/status/1213557243980812288,2020-01-04 15:26:08,"Hey, Frontier Airlines! If you want to see me happier than ever on my birthday today then you have to send me some wishes here on Twitter! ","Two hearts, Heart exclamation",957075666,AkhilSwami2,0,0,0,1,0,1,Frontier_Airlines
86,1213581214650654722,/rodcaswell/status/1213581214650654722,2020-01-04 17:01:23,Please help me get Frontier Airlines's attention: Frontier Airlines: I was charged **.** on... https://gethuman.com/issue/Frontier-Airlines/VNMD/I-was-charged-on-for-some-reason-Subsequently-I-found-that-you-sent,0,169304158,rodcaswell,0,0,0,0,0,1,Frontier_Airlines
87,1213638769582256128,/msimons981/status/1213638769582256128,2020-01-04 20:50:05,Girls take a frontier airlines flight and put travel in their insta bio like sure I guess?,0,1064546221,msimons981,0,16,1,0,0,1,Frontier_Airlines
88,1213660087606108160,/aseemdh/status/1213660087606108160,2020-01-04 22:14:48,"@FlyFrontier Frontier Airlines from Vegas to San Francisco yesterday MISPLACED OUR BAG, not even a single employee at airport. NOT ONE PERSON TO TALK TO. helpline says talk to someone at the counter. The website doesn't work to raise a request.",0,426004568,aseemdh,1,0,0,0,0,1,Frontier_Airlines
89,1213661021744709632,/aseemdh/status/1213661021744709632,2020-01-04 22:18:30,"@FlyFrontier Frontier Airlines MISPLACED OUR BAG. ! NOT ONE PERSON TO TALK TO at the airport. Helpline said talk to someone at the counter. The website doesn't assist. been 24 hours, haven't heard back. We called again today, spent 54 minutes, no answer.What service @FlyFrontier",0,426004568,aseemdh,1,0,0,0,0,1,Frontier_Airlines
90,1213666053722722304,/FaithAngel114/status/1213666053722722304,2020-01-04 22:38:30,Hey frontier airlines you GUMMY af,0,47217688,FaithAngel114,0,1,0,0,0,1,Frontier_Airlines
91,1213699989949562880,/rudytg1/status/1213699989949562880,2020-01-05 00:53:21,What's worst than spirit airline?  Frontier airlines,Right pointing backhand index (medium skin tone),131975822,rudytg1,0,0,0,0,0,1,Frontier_Airlines
92,1213746812554747904,/travelogiq/status/1213746812554747904,2020-01-05 03:59:25,Women Sue Frontier Airlines in Colorado Over Sex Assaults by Passengers - Insurance Journal http://bit.ly/2Qth5E9,0,1334084526,travelogiq,0,0,0,0,0,1,Frontier_Airlines
93,1213779636565491713,/RepChipRoyBot/status/1213779636565491713,2020-01-05 06:09:50,"On 2019-02-20, @ChipRoyTX (R-Kerrville)'s' ""Chip Roy For Congress"" reported a $218.2 expenditure to ""Frontier Airlines"", in Denver, CO for ""Travel"".

 : http://bit.ly/2Gwt7Zq",Right-pointing magnifying glass,1085293779324755968,RepChipRoyBot,0,0,0,0,0,1,Frontier_Airlines
94,1213843566767722497,/tmj_tpa_eng/status/1213843566767722497,2020-01-05 10:23:53,"Now hiring for 43 job opportunities at Frontier Airlines (@FlyFrontierJobs), Booz Allen, SAIC (@SAICjobs), and more.",0,23351497,tmj_tpa_eng,0,0,0,0,0,1,Frontier_Airlines
95,1213858724483346433,/myoung1060/status/1213858724483346433,2020-01-05 11:24:06,@BookIt             When I check my reservations at frontier airlines website my confirmation number says Cannot be found. How long will it take to show up according to them I do not have a reservation,0,1121810533072740352,myoung1060,0,0,0,0,0,1,Frontier_Airlines
96,1213860646577590273,/gw_smiles/status/1213860646577590273,2020-01-05 11:31:45,"And Kindle Unlimited is like Frontier Airlines: you get unlimited books, but only unlimited for the 1,000 we have.... the rest cost money",0,836542862,gw_smiles,1,1,0,1,0,1,Frontier_Airlines
97,1213896528668086277,/Finesse_phenom/status/1213896528668086277,2020-01-05 13:54:20,Probably frontier airlines https://twitter.com/AFKADuddy/status/1213894944668172288,0,2717863515,Finesse_phenom,1,0,0,0,0,1,Frontier_Airlines
98,1213897494532435968,/PriPri_ali/status/1213897494532435968,2020-01-05 13:58:10,Is Frontier Airlines really that bad....?,Eyes,725160738,PriPri_ali,1,0,0,0,0,1,Frontier_Airlines
99,1213949329355919361,/noalie31/status/1213949329355919361,2020-01-05 17:24:08,@FrontierCare I have to admit frontier airlines has to be the worst airlines. No communication about flight delays. Website does not have accurate information. Staff rude and not helpful.  Fly any other airlines.,0,201902224,noalie31,1,1,0,0,0,1,Frontier_Airlines
0,1212175047793815552,/TexasTomBob/status/1212175047793815552,2019-12-31 19:53:47,I did not know that Alaska Airlines flew 747s.,0,387358466,TexasTomBob,0,1,0,1,0,1,Alaska_Airlines
1,1212178101293043712,/Fiicaan/status/1212178101293043712,2019-12-31 20:05:55,"Alaska Airlines 737-800 ""Salmon 30 Salmon""  Livery on final 15
#avgeek #aviationphotography #planespotting #aviation #pilot #pilotlifepic.twitter.com/BGiUK9yRH7",0,32362927,Fiicaan,3,133,23,0,0,1,Alaska_Airlines
