,ID,url,date_time,text,emoji,user_id,usernameTweet,nbr_reply,nbr_favorite,nbr_retweet,is_reply,is_retweet,sid,searchQuery
75,1242135313767632897,/StckPro/status/1242135313767632897,2020-03-23 13:05:11,"$LUV NEW ARTICLE : Southwest Airlines 'Best-Positioned' To Weather Downturn, BofA Says In Upgrade https://dashboard.stck.pro/news.php?ticker=LUV&rowid=3994110 Get all the latest $LUV related news here : https://dashboard.stck.pro/news.php?ticker=LUVpic.twitter.com/L3JmsB2OUv",0,963495628545327104,StckPro,0,0,0,0,0,1,Southwest_Airlines
76,1242139265766772742,/wendynather/status/1242139265766772742,2020-03-23 13:20:53,"Thats a lie, he works from Southwest Airlines, some aisle seat https://twitter.com/seanfsez/status/1242134179313094656",0,353963359,wendynather,3,4,0,0,0,1,Southwest_Airlines
77,1242143726027395077,/kintsugi_boy/status/1242143726027395077,2020-03-23 13:38:36,Hey @MTNRwanda Your USSD service must be in quarantine too. It's crashing more than Southwest Airlines aircrafts do right now. Please fix it. https://twitter.com/Rugaamba/status/1242132985299841031,0,737515763464953857,kintsugi_boy,1,5,0,0,0,1,Southwest_Airlines
78,1242145382248972290,/KevinWGrossman/status/1242145382248972290,2020-03-23 13:45:11,"#TheCandEs Shop Talk Podcast welcomes Kelby Tansey, Program Lead Recruitment Marketing at Southwest Airlines. Listen in on how improving candidate experience impacts #recruiting and the business bottom line (#98) @SouthwestAir @phenom_people http://bit.ly/TheCandEsShopTalk #HR #HRtechpic.twitter.com/XJKQzFr5TN",0,14738804,KevinWGrossman,0,1,2,0,0,1,Southwest_Airlines
79,1242155231049175046,/AweInclusive/status/1242155231049175046,2020-03-23 14:24:19,Why I Still LUV Southwest Airlines http://rviv.ly/qLI0FR #travel,0,372265746,AweInclusive,0,1,0,0,0,1,Southwest_Airlines
80,1242161847043842048,/BizProfDiToro/status/1242161847043842048,2020-03-23 14:50:37,@POTUS @realDonaldTrump @SouthwestAir @FoxNews @FoxBusiness @CNN @york_pbl  1 of 6 So Southwest Airlines will not refund my monies on a trip to Seattle that I booked months ago.  They are only offering a credit for future travel.  What a bonehead discussion this is.  All my,0,928817885245566978,BizProfDiToro,2,0,1,0,0,1,Southwest_Airlines
81,1242164055290171401,/JonRobb51158059/status/1242164055290171401,2020-03-23 14:59:23,Here you go bud I am on southwest airlines to boise pic.twitter.com/DrK7io8524,0,1007966209273466880,JonRobb51158059,0,0,0,1,0,1,Southwest_Airlines
82,1242171105017647105,/SouthwestAir/status/1242171105017647105,2020-03-23 15:27:24,"Hi, Michael. Southwest Airlines travel funds are typically held as a credit, not a giftcard. DM us more information and we'll follow up: -Alice https://twitter.com/messages/compose?recipient_id=7212562",0,7212562,SouthwestAir,0,0,0,1,0,1,Southwest_Airlines
83,1242172693148917760,/TripTravelTime/status/1242172693148917760,2020-03-23 15:33:43,Southwest Airlines cancels all flights in and out of Chicago airport https://wsbt.com/news/coronavirus/southwest-airlines-cancels-all-fights-in-and-out-of-chicago-airport,0,1209002881086476288,TripTravelTime,1,0,0,0,0,1,Southwest_Airlines
84,1242173025874849793,/ParoliniLori/status/1242173025874849793,2020-03-23 15:35:02,"@SouthwestAir Thumbs Up! After contacting Southwest Airlines by DM, tweets and completing an online form Southwest has responded. They have adjusted their Travel Funds expiration date policy.",0,4415430619,ParoliniLori,1,0,0,0,0,1,Southwest_Airlines
85,1242178611177828353,/RabidChipmunk42/status/1242178611177828353,2020-03-23 15:57:14,"Hey! I won a piece of Southwest Airlines stock from SoFi! Open a free SoFi Invest account, play the game, and automatically get entered in the grand prize drawing for up to $50,000 in stock.

Play now
https://www.sofi.com/1millioncelebration/",0,234243524,RabidChipmunk42,0,0,0,0,0,1,Southwest_Airlines
86,1242185507494400000,/CepelaPatti/status/1242185507494400000,2020-03-23 16:24:38,Here is the response I got when I suggested that Southwest Airlines refund peoples money during this unforeseen and devastating pandemic. #LockdownNow  #coronavirus #COVIDActNow #SouthwestAirlinespic.twitter.com/WePiGjVcUx,0,1013802625236717568,CepelaPatti,2,0,0,0,0,1,Southwest_Airlines
87,1242187761140076549,/Tribulation7/status/1242187761140076549,2020-03-23 16:33:35,"A few days later, my daughter & her boyfriend took a mini-vacation to Disneyworld (maybe on Southwest Airlines) & that little PR*CK posted it on social media in a very mocking way about the impending PANDEMIC. I encourage you, anyone from your company or anyone else not to use",0,1228249850,Tribulation7,1,0,0,0,0,1,Southwest_Airlines
88,1242198407076249604,/CoolPanoramas/status/1242198407076249604,2020-03-23 17:15:53,Abandoned Houston.  This is the Hobby Airport Southwest Airlines passenger drop-off and downtown Houston St. Joseph at Milam at 10:00AM this morning. Absolutely empty. pic.twitter.com/HrHlv11KiY,0,425353474,CoolPanoramas,0,0,0,0,0,1,Southwest_Airlines
89,1242200274275631104,/scarfkingOG/status/1242200274275631104,2020-03-23 17:23:19,Off brand Southwest Airlines https://twitter.com/MySportsUpdate/status/1242165717841186825,0,1227085879140728832,scarfkingOG,0,2,0,0,0,1,Southwest_Airlines
90,1242200655953084417,/gaspersopi/status/1242200655953084417,2020-03-23 17:24:50,Just about 1/2 of Tesla's mcap. Or almost 3x as much as Southwest Airlines. I'd short it if the markets were rational now.,0,5660962,gaspersopi,1,2,0,1,0,1,Southwest_Airlines
91,1242203067073863682,/Emtnester/status/1242203067073863682,2020-03-23 17:34:24,"Corporate bailout is such a cop out saying. How about say, like Southwest Airlines for ex. The public then thinks differently.",0,17196373,Emtnester,0,0,0,1,0,1,Southwest_Airlines
92,1242205872199172098,/gary_kelly/status/1242205872199172098,2020-03-23 17:45:33,"Our founder Herb believed in us, the people of Southwest Airlines, and in our ability to remain resilient in the face of adversity. Adversity does not build character, it reveals it.
(4/6)",0,3128022438,gary_kelly,1,50,9,0,0,1,Southwest_Airlines
93,1242205873042337795,/gary_kelly/status/1242205873042337795,2020-03-23 17:45:33,"We find ourselves in the greatest challenge of our generation. We dont know what the future might bring, but what I do know is the resolve and the resiliency of Southwest Airlines is unmatched and untied. We are all in this fight together.
(5/6)",0,3128022438,gary_kelly,3,60,11,0,0,1,Southwest_Airlines
94,1242205874128670721,/gary_kelly/status/1242205874128670721,2020-03-23 17:45:34,"Were committed to communicating with you as we manage through this crisis. Most of all, I want you to know how much I care for and love you all, and I will do everything I can to advocate for the great cause that is Southwest Airlines.
(6/6)",0,3128022438,gary_kelly,6,75,8,0,0,1,Southwest_Airlines
95,1242208762804334592,/investingport/status/1242208762804334592,2020-03-23 17:57:02,"Southwest Airlines 'Best-Positioned' To Weather Downturn, BofA Says In Upgrade pic.twitter.com/cpyL6AenFY",0,1193779847727894529,investingport,0,0,0,0,0,1,Southwest_Airlines
96,1242217229002969088,/channahleeveey/status/1242217229002969088,2020-03-23 18:30:41,the cure being worse than the problem = southwest airlines going under is worse than millions dying ??,0,542895523,channahleeveey,0,1,0,0,0,1,Southwest_Airlines
97,1242223405618720769,/maverickboy2/status/1242223405618720769,2020-03-23 18:55:13,"If you havent sent your message please do so. It only takes 15 seconds to complete. Just click the link. If you already completed please share to get the word out. Support Southwest Airlines and our Employees 

https://p2a.co/9vPENLR?p2asource=Southwest","Blue heart, Red heart, Yellow heart",4142726237,maverickboy2,0,1,0,0,0,1,Southwest_Airlines
98,1242228053939572746,/VizerDown/status/1242228053939572746,2020-03-23 19:13:42,That's what southwest airlines did a while back and when it spiked to above 80 they where the only ones making money.,0,1539207751,VizerDown,0,1,0,1,0,1,Southwest_Airlines
99,1242232464015269888,/afgeest/status/1242232464015269888,2020-03-23 19:31:13,I recently read the story of Southwest Airlines in Innovation Stack by Jim McKelvey (@2000F). It might be a great start ,Airplane departure,950478315047014405,afgeest,0,1,0,1,0,1,Southwest_Airlines
0,1212371066145914885,/Mattlemoo/status/1212371066145914885,2020-01-01 08:52:41,"@VirginAtlantic hi there, I booked onward flights through hawaiian airlines with your reservations team, I specifically asked if baggage was all the same and the operative said yes but on my ticket with them it shows baggage ""0PC""",0,815589791530188800,Mattlemoo,1,0,0,0,0,1,Hawaiian_Airlines
1,1212404694410121217,/FxxMxxLxx/status/1212404694410121217,2020-01-01 11:06:19,"Are you in first on Hawaiian airlines at sfo right now @danjlevy waiting to take off - if not you have a doppelgnger 

If it is you I am in seat one and wont bother you @SchittsCreek is genius btw",0,249889147,FxxMxxLxx,0,1,0,0,0,1,Hawaiian_Airlines
2,1212413872700674049,/jdubbs_25/status/1212413872700674049,2020-01-01 11:42:47,Dont fly Hawaiian airlines. If you make a change they charge $200 but also if the fare is cheaper when you rebook Hawaiian also keeps your remaining balance on top of $200 fee change. Fly SWA.,0,3356421353,jdubbs_25,0,0,0,0,0,1,Hawaiian_Airlines
3,1212430382215372804,/AmericanAir/status/1212430382215372804,2020-01-01 12:48:23,Happy New Year! We market Hawaiian Airlines flights as well and are happy to help. Please give us a shout at 800-433-7300.,0,22536055,AmericanAir,0,0,0,1,0,1,Hawaiian_Airlines
4,1212453292971831301,/aeroTELEGRAPH/status/1212453292971831301,2020-01-01 14:19:25,"Hawaiian Airlines uses the Boeing 717  for intra-island services.  
 Boeing 717
 Hawaiian Airlines 
 Maui 
 User image by @planespotting77

#boeing #717 #mauiairport #hawaiianairlines #aviation #avgeek #aviationphot https://ift.tt/39xpDBmpic.twitter.com/jsJ7sIatM2","Hibiscus, Airplane, Office building, Flag of United States, Earth globe asia-australia, Flag of United States, Camera",323400398,aeroTELEGRAPH,0,20,2,0,0,1,Hawaiian_Airlines
5,1212460007939293190,/PineappleChuckr/status/1212460007939293190,2020-01-01 14:46:06,"Phx AZ bound (@ Hawaiian Airlines Check-In Counter in Honolulu, HI) https://www.swarmapp.com/c/6hJiDyg85bl",0,89635148,PineappleChuckr,0,0,0,0,0,1,Hawaiian_Airlines
6,1212488267356147713,/omyplane/status/1212488267356147713,2020-01-01 16:38:24,There is a New post ([HD] Hawaiian Airlines Airbus A330-200 Takeoff from San Diego Int'l) on our website - Watch it there -> https://omyplane.com/commercial/airbus/a330/hd-hawaiian-airlines-airbus-a330-200-takeoff-from-san-diego-intl/?utm_source=Twitter&utm_medium=Omyplanepic.twitter.com/XrUBJPQ4gb,0,1166816118918537217,omyplane,0,0,0,0,0,1,Hawaiian_Airlines
7,1212512791539703808,/1shooters1/status/1212512791539703808,2020-01-01 18:15:51,"I'm at Hawaiian Airlines Logo Store in Honolulu, HI https://www.swarmapp.com/c/kSZRsHLU04E",0,109280963,1shooters1,0,0,0,0,0,1,Hawaiian_Airlines
8,1212564477184331777,/Bohor/status/1212564477184331777,2020-01-01 21:41:14,"There's a Hawaiian Airlines ad with the line ""We serve you a complementary meal, complete with aloha."" And I'm getting pissed, because, I mean, it's 2020, and I'm trying to be progressive and accept that 'aloha' can mean hello AND goodbye, but, what the hell, now it's a food?",0,20015238,Bohor,0,1,0,0,0,1,Hawaiian_Airlines
9,1212564979624349696,/TomPodolec/status/1212564979624349696,2020-01-01 21:43:14," DIVERSION RETURN 
Hawaiian Airlines #HA445 to Auckland returning to Honolulu. Unknown reason. 
https://fr24.com/HAL445/2361d962pic.twitter.com/Z4EVhkej61",Leftwards arrow with hook,191701613,TomPodolec,3,25,1,0,0,1,Hawaiian_Airlines
10,1212594642971086848,/fIickerjonas/status/1212594642971086848,2020-01-01 23:41:06,@Delta Im taking a flight from Honolulu to ogg airport tomorrow which I booked through you guys with my other flights but its a Hawaiian airlines flight. I got a notification that my boarding pass was ready but on the app I cant check in or view any flight information,0,926592476,fIickerjonas,1,0,0,0,0,1,Hawaiian_Airlines
11,1212595454363324416,/avishaiw/status/1212595454363324416,2020-01-01 23:44:19,"Movies I saw in 2019 on the big screen:

First- PLEDGE (@IFCMidnight)
Last- LITTLE WOMEN

Movies I saw in 2019 on the small screen:

First- STILL/BORN (2018, @Shudder)
Last- THE KID WHO WOULD BE KING (2019, Hawaiian Airlines)

Decent bookends.",0,242456653,avishaiw,0,1,0,0,0,1,Hawaiian_Airlines
12,1212638229372911616,/misaelb97/status/1212638229372911616,2020-01-02 02:34:18,"*now boarding First class passengers onto Hawaiian airlines flight...*

I Fooking wish I was a first class passenger",0,3756234672,misaelb97,1,1,0,0,0,1,Hawaiian_Airlines
13,1212679149053235200,/best_coupon/status/1212679149053235200,2020-01-02 05:16:54,Hawaiian Airlines: Save up to 40% on your Hawaii Getaway with Hawaiian Airlines! Build your https://goo.gl/fb/nwVuo2,0,181342308,best_coupon,0,0,0,0,0,1,Hawaiian_Airlines
14,1212743231194066945,/kiahunacondo/status/1212743231194066945,2020-01-02 09:31:32,Big Hawaiian Airlines flight sale to start 2020 http://dlvr.it/RMJdyppic.twitter.com/3AlySfA2fF,0,143199795,kiahunacondo,0,1,0,0,0,1,Hawaiian_Airlines
15,1212747953737207809,/GoVisitHawaii/status/1212747953737207809,2020-01-02 09:50:18,Big Hawaiian Airlines flight sale to start 2020 https://ift.tt/2rSPjYc,0,19273373,GoVisitHawaii,0,5,4,0,0,1,Hawaiian_Airlines
16,1212753426058055680,/ayeishamoses/status/1212753426058055680,2020-01-02 10:12:03,Big Hawaiian Airlines flight sale to start 2020 http://dlvr.it/RMJm7Spic.twitter.com/2cgCTjJrZS,0,3352812449,ayeishamoses,0,0,0,0,0,1,Hawaiian_Airlines
17,1212753535080763392,/DealNewsDeals/status/1212753535080763392,2020-01-02 10:12:29,Hawaiian Airlines New Year Fare Sale from $258 round-trip - http://dn.ws/avmm4,0,83925749,DealNewsDeals,0,0,0,0,0,1,Hawaiian_Airlines
18,1212757374890631168,/travelmail/status/1212757374890631168,2020-01-02 10:27:44,"The safest airlines in the world revealed: Qantas is No1 with Virgin Atlantic, Alaska Airlines and Hawaiian Airlines also making the top 20 https://trib.al/PCgI54I",0,16807921,travelmail,0,7,2,0,0,1,Hawaiian_Airlines
19,1212763617776398336,/maryplansvacay/status/1212763617776398336,2020-01-02 10:52:33,Big Hawaiian Airlines flight sale to start 2020 http://dlvr.it/RMJt2spic.twitter.com/kfoVjCi6nq,0,973636441535229953,maryplansvacay,0,0,0,0,0,1,Hawaiian_Airlines
20,1212767520123281408,/paiadude/status/1212767520123281408,2020-01-02 11:08:03,Big Hawaiian Airlines flight sale to start 2020 http://dlvr.it/RMJwPfpic.twitter.com/G73reTcGTN,0,28715900,paiadude,0,0,0,0,0,1,Hawaiian_Airlines
21,1212775703843729408,/TravelGenie1/status/1212775703843729408,2020-01-02 11:40:34,Big Hawaiian Airlines flight sale to start 2020 http://dlvr.it/RMK1cfpic.twitter.com/zrsMOCHYX6,0,346261027,TravelGenie1,0,0,0,0,0,1,Hawaiian_Airlines
22,1212808831979278336,/dannydealguru/status/1212808831979278336,2020-01-02 13:52:13,"Fly to Hawaii with Hawaiian Airlines, Round-trips from$258 https://dannydealguru.com/2020/01/02/hawaiian-airlines-sale-2/pic.twitter.com/QQEabBoCzT",0,2990456332,dannydealguru,0,2,0,0,0,1,Hawaiian_Airlines
23,1212838303113854976,/Owl_Deals/status/1212838303113854976,2020-01-02 15:49:19,User Deals: Hawaiian Airlines New Years: Roundtrip Flights to Hawaii starting at $278 (Main Cabin Saver) https://forum.owldeals.net/t/hawaiian-airlines-new-years-roundtrip-flights-to-hawaii-starting-at-278-main-cabin-saver/14123 #owldeals #bargains #coupon #blackfriday owl_deals,0,3297709220,Owl_Deals,0,0,0,0,0,1,Hawaiian_Airlines
24,1212844266915074048,/milestomemories/status/1212844266915074048,2020-01-02 16:13:01,"Hawaiian Airlines Sale, Flight to #Hawaii from $258 Roundtrip - http://bit.ly/2QDF2Ygpic.twitter.com/hiClaitDGM",0,14725353,milestomemories,0,0,0,0,0,1,Hawaiian_Airlines
25,1212845414715551744,/BoardingArea/status/1212845414715551744,2020-01-02 16:17:35,"Hawaiian Airlines Sale, Flight to Hawaii from $258 Roundtrip http://dlvr.it/RMKlHQ via @milestomemoriespic.twitter.com/oe8zoANmTp",0,14372091,BoardingArea,0,1,1,0,0,1,Hawaiian_Airlines
26,1212846327421235201,/Keaukahi_/status/1212846327421235201,2020-01-02 16:21:12,stepped on hawaiian airlines and all i see is colonizers ,Clown face,2560333706,Keaukahi_,0,11,1,0,0,1,Hawaiian_Airlines
27,1212871142492516352,/astrocrash/status/1212871142492516352,2020-01-02 17:59:49,Anyone else flying Hawaiian Airlines BOS -> HNL (Flight 89) this coming Saturday to #AAS235? Looking forward to my 12 hours in a center seat... ,Upside-down face,24090491,astrocrash,4,2,0,0,0,1,Hawaiian_Airlines
28,1212895432658972674,/SandyDeSoto24/status/1212895432658972674,2020-01-02 19:36:20,"Check out this Yelp review for Hawaiian Airlines!
https://www.yelp.com/biz/hawaiian-airlines-honolulu?hrid=s_DVYkfa_qgnaQTUafe6eA&utm_source=ishare",0,818727775808798721,SandyDeSoto24,0,0,0,0,0,1,Hawaiian_Airlines
29,1212926808603021313,/JPJets_Group/status/1212926808603021313,2020-01-02 21:41:00,"These are the world's safest airlines, according to http://AirlineRatings.com 
1. Qantas
 2. Air New Zealand 
3. EVA Air 
4. Etihad 
5. Qatar Airways
6. Singapore Airlines 
7. Emirates 
8. Alaska Airlines  
9. Cathay Pacific Airways 
10. Virgin Australia
11. Hawaiian Airlines pic.twitter.com/a5Vq5bjyLm",0,1131375500411265027,JPJets_Group,1,3,4,0,0,1,Hawaiian_Airlines
30,1212949892596817921,/HCCNC/status/1212949892596817921,2020-01-02 23:12:44,"Hawaiian Airlines is having special fares during their New Year's Sale for roundtrip bookings from the Mainland to Hawaii, now - 01-06-20. https://on.hwnair.com/2ZMpaH5pic.twitter.com/WjbBQrdSir",0,57580977,HCCNC,0,1,0,0,0,1,Hawaiian_Airlines
31,1212992096682070016,/27Tawnyowl/status/1212992096682070016,2020-01-03 02:00:26,"The safest airlines in the world revealed: Qantas is No1 with Virgin Atlantic, Alaska Airlines and Hawaiian Airlines also making the top 20
via https://dailym.ai/ioshttps://mol.im/a/7845329",0,193413930,27Tawnyowl,0,0,0,0,0,1,Hawaiian_Airlines
32,1213068219784691715,/thandojo/status/1213068219784691715,2020-01-03 07:02:55,"The safest #airlines in the world revealed: #Qantas is No1 with Virgin Atlantic, Alaska Airlines and Hawaiian Airlines also making the top 20 http://AirlineRatings.com revealed the top 20 safest carriers after studying 400pic.twitter.com/AELGlx1IKn",0,1376011723,thandojo,0,0,0,0,0,1,Hawaiian_Airlines
33,1213078690231246849,/satsu_toma/status/1213078690231246849,2020-01-03 07:44:32,"HAWAIIAN AIRLINES
Airbus A330-243(N395HA)
2020.01.03 CTS/RJCC pic.twitter.com/HJXGpPJWX3",0,4055234540,satsu_toma,0,4,0,0,0,1,Hawaiian_Airlines
34,1213103891820138497,/realYannYang/status/1213103891820138497,2020-01-03 09:24:40,"Qantas, Air New Zealand, EVA Air, Etihad, Qatar Airways, Singapore Airlines, Emirates, Alaska Airlines, Cathay Pacific Airways, Virgin Australia, Hawaiian Airlines, Virgin Atlantic Airlines, TAP Portugal, SAS, Royal Jordanian, Swiss, #Finnair, Lufthansa, Aer Lingus, and KLM.",0,226491642,realYannYang,1,1,1,0,0,1,Hawaiian_Airlines
35,1213104498421317633,/Dealfinder9/status/1213104498421317633,2020-01-03 09:27:05,Hawaiian Airlines New Year Fare Sale from $258 round-trip https://www.dealnews.com/Hawaiian-Airlines-New-Year-Fare-Sale-from-258-round-trip/18271804.html?iref=rss-dealnews-hottest&utm_source=dlvr.it&utm_medium=twitter,0,499057794,Dealfinder9,0,0,0,0,0,1,Hawaiian_Airlines
36,1213113040985624576,/YanksAirMuseum/status/1213113040985624576,2020-01-03 10:01:02,Hawaiian Airlines launches new career pathway for pilots - Pacific Business News - https://bit.ly/2tp1sV2,0,378058308,YanksAirMuseum,0,0,1,0,0,1,Hawaiian_Airlines
37,1213151779065606145,/dannydealguru/status/1213151779065606145,2020-01-03 12:34:58,"Fly to Hawaii with Hawaiian Airlines, Round-trips from $258 https://dannydealguru.com/2020/01/02/hawaiian-airlines-sale-2/ via @dannydealguru",0,2990456332,dannydealguru,0,1,0,0,0,1,Hawaiian_Airlines
38,1213169086869336064,/kbrsloat/status/1213169086869336064,2020-01-03 13:43:44,"Hey @cirium, how much does @deltaairlines pay you to completely ignore hawaii and Hawaiian Airlines from your global rankings of on time airlines?",0,11319932,kbrsloat,0,1,0,1,0,1,Hawaiian_Airlines
39,1213174828347412482,/ChiBizJournal/status/1213174828347412482,2020-01-03 14:06:33,OAG has released its Punctuality League report which shows Hawaiian Airlines and Delta Air Lines topping all North America-based airlines. https://www.bizjournals.com/chicago/news/2020/01/03/delta-air-lines-and-hawaiian-were-most-on-time.html?ana=TRUEANTHEMTWT_CG&taid=5e0f90b9b1b456000180aad4&utm_campaign=trueAnthem%3A+New+Content+%28Feed%29&utm_medium=trueAnthem&utm_source=twitter,0,803179230,ChiBizJournal,0,0,0,0,0,1,Hawaiian_Airlines
40,1213226295057928193,/svbizjournal/status/1213226295057928193,2020-01-03 17:31:04,OAG has released its Punctuality League report which shows Hawaiian Airlines and Delta Air Lines topping all North America-based airlines. https://www.bizjournals.com/sanjose/news/2020/01/03/delta-air-lines-and-hawaiian-were-most-on-time.html?ana=TRUEANTHEMTWT_JO&taid=5e0fc0a748fe970001449dd7&utm_campaign=trueAnthem%3A+Trending+Content&utm_medium=trueAnthem&utm_source=twitter,0,17625154,svbizjournal,0,0,0,0,0,1,Hawaiian_Airlines
41,1213227050443497472,/RockCheetah/status/1213227050443497472,2020-01-03 17:34:04,OAG study finds Hawaiian Airlines is timeliest U.S. airline http://j.mp/2ZMztuu #newspic.twitter.com/oqwe7P3XBk,0,19733334,RockCheetah,0,0,0,0,0,1,Hawaiian_Airlines
42,1213230859425333248,/thenaziapasha/status/1213230859425333248,2020-01-03 17:49:12,Latest Travel News from Nazia PashaOAG study finds Hawaiian Airlines is timeliest U.S. airline https://ift.tt/2QHngU0,0,1949610386,thenaziapasha,0,0,0,0,0,1,Hawaiian_Airlines
43,1213231614815297538,/ExpertFlyer/status/1213231614815297538,2020-01-03 17:52:12,OAG study finds Hawaiian Airlines is timeliest U.S. airline https://ift.tt/2QHngU0,0,15303626,ExpertFlyer,0,0,0,0,0,1,Hawaiian_Airlines
44,1213234099927695360,/FoxyKealoha/status/1213234099927695360,2020-01-03 18:02:04,"Is anyone familiar with the Kauai Farmacy on Kaua'i? They are listed on the Hawaiian Airlines website as a The Top Nine Hawaii Eco Tours with ""Discover Natures Medicine Cabinet"" and am not seeing anything which acknowledges Native Hawaiians
#kanakatwitter
https://www.hawaiianairlines.com/island-guide/kauai/places/adventures/kauai-farmacy",0,903388383514312705,FoxyKealoha,0,2,1,0,0,1,Hawaiian_Airlines
45,1213242647403347969,/RockCheetah/status/1213242647403347969,2020-01-03 18:36:02,OAG study finds Hawaiian Airlines is timeliest U.S. carrier http://j.mp/2Fffz21 #newspic.twitter.com/MDFJCUnHG5,0,19733334,RockCheetah,0,0,0,0,0,1,Hawaiian_Airlines
46,1213257193363034112,/FireandAviation/status/1213257193363034112,2020-01-03 19:33:50,Hawaiian Airlines launches new career pathway for pilots https://www.bizjournals.com/pacific/news/2019/12/30/hawaiian-airlines-launches-new-career-pathway-for.html via @Pacificbiznews,0,2502805669,FireandAviation,0,0,0,0,0,1,Hawaiian_Airlines
47,1213263264282398720,/kbrsloat/status/1213263264282398720,2020-01-03 19:57:58,"so I called out @cirium for releasing their airline on-time-performance results, which labeled Delta as the #1 airline in north america, while completely omitting Hawaii and Hawaiian Airlines from any geographic region they reported.  They blocked me.  Guess I hit close to home.",0,11319932,kbrsloat,0,0,0,0,0,1,Hawaiian_Airlines
48,1213264036793651200,/LABizJournal/status/1213264036793651200,2020-01-03 20:01:02,OAG has released its Punctuality League report which shows Hawaiian Airlines and Delta Air Lines topping all North America-based airlines. https://www.bizjournals.com/losangeles/news/2020/01/03/delta-air-lines-and-hawaiian-were-most-on-time.html?ana=TRUEANTHEMTWT_WI&taid=5e0fe3ceb19b7e000192d268&utm_campaign=trueAnthem%3A+Trending+Content&utm_medium=trueAnthem&utm_source=twitter,0,803208272,LABizJournal,0,0,0,0,0,1,Hawaiian_Airlines
49,1213272445076951040,/harriswright6/status/1213272445076951040,2020-01-03 20:34:27,Hawaiian Airlines reached out to me for flight attendant #2020 is gonna be my year,"Hundred points symbol, Folded hands (medium light skin tone)",2603013684,harriswright6,1,4,0,0,0,1,Hawaiian_Airlines
50,1213276118255468545,/HectorH92552479/status/1213276118255468545,2020-01-03 20:49:02,OAG study finds Hawaiian Airlines is timeliest U.S. carrier http://dlvr.it/RMPMP2pic.twitter.com/zoSfuEHjRZ,0,1128421193491656704,HectorH92552479,0,0,0,0,0,1,Hawaiian_Airlines
51,1213278595956625408,/amycharleston/status/1213278595956625408,2020-01-03 20:58:53,He flew with Hawaiian Airlines back to Sydney.,0,85007875,amycharleston,1,1,0,1,0,1,Hawaiian_Airlines
52,1213298176930660352,/2391Kex/status/1213298176930660352,2020-01-03 22:16:42,Hawaiian Airlines has brought me back to paradise ... pic.twitter.com/GFaqcBZ1yQ,0,823213934849196036,2391Kex,1,3,0,0,0,1,Hawaiian_Airlines
53,1213298212678885376,/Hammocknaps/status/1213298212678885376,2020-01-03 22:16:50,"""""Alaska Airlines and Allegiant win the top spot with the safest water in the sky, and Hawaiian Airlines finishes No. 2,""
""The airlines with the worst scores, the team said, are JetBlue and Spirit Airlines."" https://www.travelandleisure.com/airlines-airports/airlines-with-the-best-water-quality?utm_source=facebook.com&utm_medium=social&utm_campaign=social-share-article&utm_content=20200104&utm_term=791059",0,784103077779378179,Hammocknaps,0,0,0,0,0,1,Hawaiian_Airlines
54,1213340525740167168,/arakitas/status/1213340525740167168,2020-01-04 01:04:58,my bf's mom booked thru hawaiian airlines and she said we only got a personal and carry on ,"Face with look of triumph, Face with look of triumph, Face with look of triumph",1079785930481782789,arakitas,0,0,0,1,0,1,Hawaiian_Airlines
