,ID,url,date_time,text,emoji,user_id,usernameTweet,nbr_reply,nbr_favorite,nbr_retweet,is_reply,is_retweet,sid,searchQuery
0,1234594290463952898,/OleDanyeller/status/1234594290463952898,2020-03-02 16:39:51,"Our plane hasnt even unhooked from the gate and some kid is wailing - damn kid I know its spirit airlines, but can you chill?",0,36178433,OleDanyeller,0,0,0,0,0,1,Spirit_Airlines
1,1234602239685038080,/airlinefilings/status/1234602239685038080,2020-03-02 17:11:26,Accessible Lavatories on Single-Aisle Aircraft - Comments of Spirit Airlines: https://airlineinfo.com/ost22/ost030220.html#Lavatories,0,77308964,airlinefilings,1,0,0,0,0,1,Spirit_Airlines
2,1234604773355216896,/noimnotjewish/status/1234604773355216896,2020-03-02 17:21:30,"What it's like flying Spirit Airlines:

Ticket: $250
Checked luggage: $75
Carry-on: $30
Shortcut security: $6
Shortcut boarding: $6
Choose your seat: $13-25
Drink: $5
No thanks: $2
Look out window: $10
Use bathroom: $5
Hold it: $4
Leave plane: $9",0,525507986,noimnotjewish,0,1,0,0,0,1,Spirit_Airlines
3,1234605823860596736,/HoustonInterAir/status/1234605823860596736,2020-03-02 17:25:40,Squawk 4437 Weather reconnassiance: A658DE/N508NK//SPIRIT AIRLINES INC https://flightaware.com/live/modes/A658DE/ident/N508NK/redirect,0,883822385274773505,HoustonInterAir,0,0,0,0,0,1,Spirit_Airlines
4,1234614740493754368,/jiamingho/status/1234614740493754368,2020-03-02 18:01:06,"If my Argonne experiment got cancelled I will be the favorite client of Spirit Airlines, bought multiple tickets, and giving them for free.",0,538179498,jiamingho,0,0,0,0,0,1,Spirit_Airlines
5,1234615027887415296,/mexklems/status/1234615027887415296,2020-03-02 18:02:15,Septa you are the spirit airlines of railroads,0,563822220,mexklems,1,5,0,0,0,1,Spirit_Airlines
6,1234615206740926465,/thepointsguy/status/1234615206740926465,2020-03-02 18:02:57,Spirit Airlines plans first international routes from New Orleans https://the.pointsg.uy/KHZr97B,0,34176543,thepointsguy,1,8,4,0,0,1,Spirit_Airlines
7,1234616234487894017,/RockCheetah/status/1234616234487894017,2020-03-02 18:07:03,Spirit Airlines plans first international routes from New Orleans http://dlvr.it/RR6mRr #blogpic.twitter.com/4QODDgn5NB,0,19733334,RockCheetah,0,0,0,0,0,1,Spirit_Airlines
8,1234616609894875136,/FortyTravel/status/1234616609894875136,2020-03-02 18:08:32,Spirit Airlines plans first international routes from New Orleans http://dlvr.it/RR6mcr #News #AirlineRoutespic.twitter.com/FEaY8OzpCQ,0,1093336401851150336,FortyTravel,0,0,0,0,0,1,Spirit_Airlines
9,1234619107120537605,/tuhreesaa/status/1234619107120537605,2020-03-02 18:18:27,Has anyone flown with Spirit Airlines? Is it as bad as people say it is?,0,382378903,tuhreesaa,5,1,0,0,0,1,Spirit_Airlines
10,1234619567013580801,/MannyTwice/status/1234619567013580801,2020-03-02 18:20:17,Nigga said Spirit airlines drive you to your destination like the Megabus ,"Face with tears of joy, Face with tears of joy",2710772389,MannyTwice,0,0,0,0,0,1,Spirit_Airlines
11,1234620429626740738,/MannyTwice/status/1234620429626740738,2020-03-02 18:23:43,For niggas to hate Spirit airlines they sure ain't had a crash yet tho,0,2710772389,MannyTwice,0,0,0,0,0,1,Spirit_Airlines
12,1234621392831696896,/DarrynWeinstein/status/1234621392831696896,2020-03-02 18:27:32,Spirit Airlines Keeps Up Cancun Expansion in New Orleans http://dlvr.it/RR6pvQ,0,25513997,DarrynWeinstein,0,0,0,0,0,1,Spirit_Airlines
13,1234621994437619719,/Santino_1033/status/1234621994437619719,2020-03-02 18:29:56,I thought I saw Vanessa Hudgens flying spirit airlines and I almost unfollowed her for fraudulent activities on all socials,0,807481360235433984,Santino_1033,0,0,0,0,0,1,Spirit_Airlines
14,1234623766031790080,/Liyah0329/status/1234623766031790080,2020-03-02 18:36:58,"Im still finding flights , spirit airlines is the only one thats cheap lol and possibly may not happen since someone gave two weeks notice ugh ",Weary face,136353014,Liyah0329,0,0,0,1,0,1,Spirit_Airlines
15,1234626251895140352,/Champwillis/status/1234626251895140352,2020-03-02 18:46:51,May have to fly spirit airlines to Vegas ,"Weary face, Weary face, Weary face",32147953,Champwillis,0,2,0,0,0,1,Spirit_Airlines
16,1234628963793809410,/e_russell/status/1234628963793809410,2020-03-02 18:57:37,Spirit Airlines plans first international routes from New Orleans http://bit.ly/2PEPleK,0,51659154,e_russell,0,1,1,0,0,1,Spirit_Airlines
17,1234629561683329031,/JoinFlyline/status/1234629561683329031,2020-03-02 19:00:00,"FlyLine Deal:  Round-trip flight on Spirit Airlines, Frontier from Las Vegas to Boston for just $194.00 on 03/25 -> 03/31! Visit http://joinflyline.com and book it #FlyLine #Travel #Wanderlust #Trip #TravelTheWorld",0,1192134402098237444,JoinFlyline,0,0,0,0,0,1,Spirit_Airlines
18,1234634732417118208,/jamaica/status/1234634732417118208,2020-03-02 19:20:33,"Spirit Airlines Keeps Up Cancun Expansion in New Orleans: The low-cost carrier announced plans to add yet another new route to the ultra-popular destination on the Caribbean coast of Mexico, this time with... http://bit.ly/2TBygn4",0,14303545,jamaica,0,2,0,0,0,1,Spirit_Airlines
19,1234635127336165376,/JPJets_Group/status/1234635127336165376,2020-03-02 19:22:07,"Spirit Airlines the ultra-low-cost carrier has now added the sixth city to gain flights to Cancun Mexico this year. It will now fly to Cancun from New Orleans.
@SpiritAirlines @msyinfo #Cancun #Mexico #flights #airline #Travel #aviationdaily #NewOrleanspic.twitter.com/Q5u0LgQHIF",0,1131375500411265027,JPJets_Group,0,1,0,0,0,1,Spirit_Airlines
20,1234636784677588992,/nikolasdiallo/status/1234636784677588992,2020-03-02 19:28:42,Thats that new Spirit Airlines car insurance.,0,1006666634,nikolasdiallo,1,1,0,1,0,1,Spirit_Airlines
21,1234648770480136192,/YODA_Liberace/status/1234648770480136192,2020-03-02 20:16:20,"Seriously though, has anyone on my TL flown Spirit Airlines? Is it really that bad lol?",0,121324783,YODA_Liberace,2,0,0,0,0,1,Spirit_Airlines
22,1234659349223464961,/Seygehofficalyt/status/1234659349223464961,2020-03-02 20:58:22,@_jer18_ @SpiritAirlines Every single time I've used spirit airlines they either messed up my reservation or my lost my luggage or something happened.  That is why I never fly #spirit anymore.  I will pay the extra 30-50 dollars to not have to deal with them.,0,2837912554,Seygehofficalyt,0,0,0,1,0,1,Spirit_Airlines
23,1234662378278543361,/cornpumpthirsty/status/1234662378278543361,2020-03-02 21:10:24,Spirit airlines. The Walmart of air transportation,0,1159594297467002880,cornpumpthirsty,0,0,0,1,0,1,Spirit_Airlines
24,1234671784147841024,/louisshotwell/status/1234671784147841024,2020-03-02 21:47:47,You got Louie luggage but youre on Spirit airlines...,0,1187182482,louisshotwell,0,3,0,0,0,1,Spirit_Airlines
25,1234696764181008385,/MikeGlassDenver/status/1234696764181008385,2020-03-02 23:27:02,This is your captain. You are now free to move around the cabin. Thank you for flying Spirit Airlines.,0,245623328,MikeGlassDenver,18,5439,340,1,0,1,Spirit_Airlines
26,1234700093359624193,/oTheStrokes/status/1234700093359624193,2020-03-02 23:40:16,Has anyone used Spirit Airlines before? Thoughts?,0,558745275,oTheStrokes,2,0,0,0,0,1,Spirit_Airlines
27,1234714786501451776,/findingadrian/status/1234714786501451776,2020-03-03 00:38:39,Nashville Metro lands another tech company just a few days after Spirit Airlines announced its move to Nashville #Starbuckspic.twitter.com/xOMjYjowwc,0,2507243704,findingadrian,0,0,0,0,0,1,Spirit_Airlines
28,1234732383729045506,/ScienceDoge/status/1234732383729045506,2020-03-03 01:48:35,"Its the year 2031 She peers off the landing stair with her steeled gaze.... she laments attempting to board with Twins. ""I Just couldn't afford the second one with Spirit airlines charging by the ounce for all luggage items including unticketed passengers, but its for the best.""",0,36107690,ScienceDoge,0,2,1,1,0,1,Spirit_Airlines
29,1234757252684406784,/WorldPassport/status/1234757252684406784,2020-03-03 03:27:24,Spirit Airlines plans first international routes from New Orleans https://thepointsguy.com/news/spirit-airlines-plans-first-international-routes-from-new-orleans/ #travel #explore,0,2717519659,WorldPassport,0,0,0,0,0,1,Spirit_Airlines
30,1234763500863598592,/TSIUSA/status/1234763500863598592,2020-03-03 03:52:14,"Spirit Airlines adds international flights from New Orleans despite virusNEW ORLEANS- Spirit Airlines is expanding the Crescent City's international reach with two new destinations, the airline announced Monday. https://ift.tt/2VHlINI",0,362078356,TSIUSA,0,0,0,0,0,1,Spirit_Airlines
31,1234763510862766081,/TSIUSA/status/1234763510862766081,2020-03-03 03:52:16,"Spirit Airlines plans first international routes from New OrleansSpirit Airlines will add its first international routes from New Orleans this June, connecting the city with Cancun and San Pedro Sula, Honduras. https://ift.tt/2VDl1Fe",0,362078356,TSIUSA,0,0,0,0,0,1,Spirit_Airlines
32,1234796019554144258,/sunherald/status/1234796019554144258,2020-03-03 06:01:27,"New Orleans has a Honduran population estimated to be 100,000, one of the largest in the U.S., and there is regular demand for travel, Spirit Airlines said. https://trib.al/n8AK10k",0,12810582,sunherald,0,0,0,0,0,1,Spirit_Airlines
33,1234797686471233536,/wtraveledgadget/status/1234797686471233536,2020-03-03 06:08:04,Travel news: Spirit Airlines plans first international routes from New Orleans https://qoo.ly/34pngw,0,828005647199432705,wtraveledgadget,0,0,0,0,0,1,Spirit_Airlines
34,1234806835590373377,/jody_lecompte/status/1234806835590373377,2020-03-03 06:44:25,I survived a spirit airlines flight. AMA.,0,790083419707469828,jody_lecompte,0,0,0,0,0,1,Spirit_Airlines
35,1234811904712790017,/RusTourismNews/status/1234811904712790017,2020-03-03 07:04:34,#AviationNews #NewOrleans #SpiritAirlines Spirit Airlines to Launch New Orleans  Cancun Flights http://dlvr.it/RR8SN2pic.twitter.com/n3OFHIO0PC,0,492657081,RusTourismNews,0,0,0,0,0,1,Spirit_Airlines
36,1234812552070258689,/yologetaways/status/1234812552070258689,2020-03-03 07:07:08,Spirit Airlines Expands Internationally in New Orleans | Yolo Getaways https://yologetaways.agentstudio.com/news/spirit-airlines-expands-internationally-in-new-orleans.html,0,2312334187,yologetaways,0,0,0,0,0,1,Spirit_Airlines
37,1234815277122060288,/BobSalera/status/1234815277122060288,2020-03-03 07:17:58,"Theres a Spirit Airlines attendant on my plane wiping down an entire row, including the wall and ceiling, with Clorox wipes...Im on an American Airlines plane.",0,1570799947,BobSalera,1,9,0,0,0,1,Spirit_Airlines
38,1234816286003167235,/TulipCassidy/status/1234816286003167235,2020-03-03 07:21:59,Yeah lets completely #bankrupt the treasury like youve done to all your businesses bc of your terrible choices. (Remember Spirit Airlines? So much pretentious decor the planes were too heavy to leave the ground!),0,280045851,TulipCassidy,0,0,0,1,0,1,Spirit_Airlines
39,1234822248445423617,/__ThaFinest/status/1234822248445423617,2020-03-03 07:45:40,I gave Spirit Airlines 2 YEARS of my life! Yall can stop asking me about a flight. I put my 2 weeks in 3 years ago  I do NOT work at the Airport anymore.,Loudly crying face,1235866436,__ThaFinest,0,0,0,0,0,1,Spirit_Airlines
40,1234827134549426192,/RPorkins/status/1234827134549426192,2020-03-03 08:05:05,Spirit Airlines Just Somehow Got Worse,0,1034439480084652033,RPorkins,0,0,0,1,0,1,Spirit_Airlines
41,1234838853510483970,/katbankz/status/1234838853510483970,2020-03-03 08:51:39,I have two flights on spirit airlines today lol,0,832420747,katbankz,0,0,0,0,0,1,Spirit_Airlines
42,1234840955959664640,/JoinFlyline/status/1234840955959664640,2020-03-03 09:00:00,FlyLine Deal:  Round-trip flight on Spirit Airlines from Chicago to Charlotte for just $121.00 on 03/10 -> 03/11! Visit http://joinflyline.com and book it #FlyLine #Travel #Wanderlust #Trip #TravelTheWorld,0,1192134402098237444,JoinFlyline,0,1,0,0,0,1,Spirit_Airlines
43,1234849386397667330,/bossladylish__/status/1234849386397667330,2020-03-03 09:33:30,Frontier and Spirit airlines was made for the Mexicans,0,3033601246,bossladylish__,0,0,0,0,0,1,Spirit_Airlines
44,1234853909618970629,/benmutzabaugh/status/1234853909618970629,2020-03-03 09:51:29,"Spirit Airlines to add international routes (Mexico, Honduras) from New Orleans; will be up to 22 destinations from the city http://bit.ly/2VIuFGr",0,15811202,benmutzabaugh,1,6,1,0,0,1,Spirit_Airlines
45,1234858410883112964,/dickle62/status/1234858410883112964,2020-03-03 10:09:22,"If anyone is thinking about flying Spirit Airlines. DONT,!!! From the time you check in until the time you land. Most rotten people Ive ever had the miss fortune of meeting. I was traveling with a sick child, going to get help for her out of state. They went through my bags",0,3389678674,dickle62,0,0,0,1,0,1,Spirit_Airlines
46,1234861357360668672,/zitherbelll/status/1234861357360668672,2020-03-03 10:21:04,"...I will finally depart Auk... Mexico ...confirmed Spirit Airlines Flight 260
Apr 4-Confirmation #N9WJ6V-No Updates
San Diego SAN
10:22 AM
Las Vegas LAS
11:41 AMhttps://www.youtube.com/watch?v=mCHUw7ACS8o",0,1733381190,zitherbelll,1,0,0,0,0,1,Spirit_Airlines
47,1234862324240015360,/dickle62/status/1234862324240015360,2020-03-03 10:24:55,"Just returned from the worst flight ever. Spirit airlines! My daughter has less than five years to live in a wheelchair. From the time I got there until the time I arrived was treated awful. Man, treated totally different, bend over backwards for men. Women even with a sick child",0,3389678674,dickle62,0,0,0,1,0,1,Spirit_Airlines
48,1234872133458812930,/USTOA/status/1234872133458812930,2020-03-03 11:03:54,"Coronavirus update: Airline executives fromAmerican Airlines, United Airlines, Southwest Airlines, Spirit Airlines, and JetBlue Airways will be meeting with Vice President Pence tomorrow. He will also be meeting with cruise line executives in Florida this Saturday. #cornoavirus",0,58561660,USTOA,0,1,0,0,0,1,Spirit_Airlines
49,1234872668165492738,/IvanteevaYana/status/1234872668165492738,2020-03-03 11:06:01,spirit airlines flight 224 http://travel-insurance.northtosouth.site/paroxysmal-atrial-fibrillation-travel-insurance airline flight engineer,0,874197140221956101,IvanteevaYana,0,0,0,0,0,1,Spirit_Airlines
50,1234872827259629571,/SherlockHelms/status/1234872827259629571,2020-03-03 11:06:39,"SHIT I MISSED ANOTHER DAY! We slept in, did some laundry, then caught a flight around 5pm for Berlin. The massive backpacks didnt even give us issue on the spirit airlines of Europe! We got a delicious german dinner and found a German bottle shop. He gave a gr8 list of spots pic.twitter.com/tGJNcrAJBt",0,218745149,SherlockHelms,1,1,0,0,0,1,Spirit_Airlines
51,1234875059229073413,/kwuchu/status/1234875059229073413,2020-03-03 11:15:31,"Bruh, I hate having to buy flights to Myrtle Beach. Ain't nobody wanna fly direct with Spirit Airlines. ",Loudly crying face,291911739,kwuchu,6,19,0,0,0,1,Spirit_Airlines
52,1234875126421872640,/shannonmakeupma/status/1234875126421872640,2020-03-03 11:15:47,"The answer from Spirit Airlines in regards to not having working bathrooms and water on my nonstop flight from Boston to Las Vegas! I am dying .. clearly, people can be safe washing there hands with sanitary wipes and bottled water! @SpiritAirlinespic.twitter.com/MP64xTnZ3S","Rolling on the floor laughing, Nauseated face",1121898201907433473,shannonmakeupma,0,0,0,0,0,1,Spirit_Airlines
53,1234880916268425222,/nottooshabbydc/status/1234880916268425222,2020-03-03 11:38:48,Reclining is the devil's work. #bantherecline Spirit Airlines may suck in many ways but at least they got this one thing right,0,33616106,nottooshabbydc,0,0,0,1,0,1,Spirit_Airlines
54,1234881944455974913,/Abbi6God/status/1234881944455974913,2020-03-03 11:42:53,SPIRIT AIRLINES BUGGIN https://twitter.com/gnuman1979/status/1234678426415456260,0,309893344,Abbi6God,0,2,0,0,0,1,Spirit_Airlines
55,1234882699875225600,/xMiaMoon/status/1234882699875225600,2020-03-03 11:45:53,FLYING ON SPIRIT AIRLINES https://twitter.com/DundareeD/status/1234864821046214663,0,40946843,xMiaMoon,0,0,0,0,0,1,Spirit_Airlines
56,1234885435781976065,/DavidLeBlanc95/status/1234885435781976065,2020-03-03 11:56:45,I really thought when I flew Spirit Airlines the other day I was going to be offered Menthol Cigarettes.,0,1068032237088763904,DavidLeBlanc95,0,1,0,0,0,1,Spirit_Airlines
57,1234889514814001157,/mikexsweat/status/1234889514814001157,2020-03-03 12:12:58,Via spirit airlines?,0,1026898946,mikexsweat,1,0,0,1,0,1,Spirit_Airlines
58,1234890834643808256,/dickle62/status/1234890834643808256,2020-03-03 12:18:12,"@SpiritAirlines Will never fly Spirit Airlines again! Ive used spirit for the last four times in four months, unfortunately. Went to Cleveland clinic with a very sick daughter, has less than five years to live. Not only was I treated absolutely indescribable. They couldnt Care",0,3389678674,dickle62,0,0,0,0,0,1,Spirit_Airlines
59,1234892564701958144,/dickle62/status/1234892564701958144,2020-03-03 12:25:05,"@realDonaldTrump I voted for you. But a month too late to stop flights coming in from China. Really? I just flew Spirit Airlines, worst ever with a sick less than five years to live child. How about they clean the plane? In the seats waiting for the plane",0,3389678674,dickle62,0,0,0,0,0,1,Spirit_Airlines
60,1234892648407691264,/_kingbmc/status/1234892648407691264,2020-03-03 12:25:25,I was watching this standup last night with French subtitles on (for practicing French) and there was a joke about Spirit airlines that the subtitles changed to Ryan ,Face with tears of joy,4447105714,_kingbmc,1,1,0,1,0,1,Spirit_Airlines
61,1234893719817486336,/dickle62/status/1234893719817486336,2020-03-03 12:29:40,@dbongino I voted for Trump. Love you love your show. The view Anna Navarro. Total idiot. Too many of those on the TV. #FakeNews  just flew Spirit Airlines/awful clean the planes. People are nasty and spirit. My daughter is dying/unreal Good job airlines,0,3389678674,dickle62,0,0,0,0,0,1,Spirit_Airlines
62,1234899835939151874,/RafaelCanales18/status/1234899835939151874,2020-03-03 12:53:58,Spirit airlines needs some milk,0,3224981424,RafaelCanales18,0,1,0,0,0,1,Spirit_Airlines
63,1234901352557363200,/JoinFlyline/status/1234901352557363200,2020-03-03 13:00:00,"FlyLine Deal:  Round-trip flight on Spirit Airlines, Delta from Los Angeles to Seattle for just $134.00 on 03/24 -> 03/31! Visit http://joinflyline.com and book it #FlyLine #Travel #Wanderlust #Trip #TravelTheWorld",0,1192134402098237444,JoinFlyline,0,0,0,0,0,1,Spirit_Airlines
64,1234904773658152960,/CuzzinTom/status/1234904773658152960,2020-03-03 13:13:36,"I just high fived everybody in Irvine, CA and am about to catch a cross country flight on spirit airlines.  I have not washed my hands.

If I dont have Coronavirus by tomorrow then it's either a hoax or I AM THE VACCINE! (And I'll be selling my blood on Patreon)",0,465093889,CuzzinTom,0,2,0,0,0,1,Spirit_Airlines
65,1234913194595905536,/Jane__Says__/status/1234913194595905536,2020-03-03 13:47:03,"I have a spirit airlines card they gave me 10,000 miles just for being approved but I hate spirit so I never use my miles lolol.",0,320384951,Jane__Says__,1,1,0,1,0,1,Spirit_Airlines
66,1234928327829475328,/WandrMe/status/1234928327829475328,2020-03-03 14:47:11,Interesting crew training comment from Spirit Airlines: Claims all outsourced contractors go through the same training process as in-house employees. That's gotta be quite a challenge logistically. #PaxEx,0,66185093,WandrMe,2,0,0,0,0,1,Spirit_Airlines
67,1234928912993525762,/newmoneyFC/status/1234928912993525762,2020-03-03 14:49:31,I know Im going to regret this but I think it is significantly overdone and almost ridiculous as it has almost no exposure to business travel and all of its international business is in South America.. Spirit Airlines $SAVE if I had the money I would do a hostile takeover!,0,3278201701,newmoneyFC,2,0,0,0,0,1,Spirit_Airlines
68,1234929140425342976,/jetsettersblog/status/1234929140425342976,2020-03-03 14:50:25,"Spirit Airlines international routes from New Orleans..

https://jetsettersblog.com/spirit-airlines-international-routes-from-new-orleans/pic.twitter.com/5h8gxbkYHP",0,704819773,jetsettersblog,0,2,0,0,0,1,Spirit_Airlines
69,1234929547314782208,/Zack_Andreska/status/1234929547314782208,2020-03-03 14:52:02,Just fly spirit airlines to Phoenix and road trip wit us gang gang,0,1442253360,Zack_Andreska,1,1,0,1,0,1,Spirit_Airlines
70,1234929704563617793,/newmoneyFC/status/1234929704563617793,2020-03-03 14:52:40,"If I had $5B cash laying around, I would buy Spirit Airlines $SAVE outrite at these prices.. Push the button Warren!",0,3278201701,newmoneyFC,1,1,0,0,0,1,Spirit_Airlines
71,1234930262515081218,/BruceKamich/status/1234930262515081218,2020-03-03 14:54:53,Spirit Airlines Breaks to a Multi-Year Low as Quant Recommendation Weakens https://realmoney.thestreet.com/investing/spirit-airlines-breaks-to-a-multi-year-low-as-quant-recommendation-weakens-15256317 via @RealMoney,0,1410125744,BruceKamich,0,1,0,0,0,1,Spirit_Airlines
72,1234933729660940290,/nicolemarinei/status/1234933729660940290,2020-03-03 15:08:39,Spirit Airlines lmao,0,704726011787747330,nicolemarinei,0,0,0,1,0,1,Spirit_Airlines
73,1234935799789031427,/KaeSmooth/status/1234935799789031427,2020-03-03 15:16:53,"Keep it 1k, Spirit Airlines isnt that bad, really depends on how far youre flying, my only rift is the up-charge  for baggage. But, Ive never had a bad experience",0,75951808,KaeSmooth,1,1,0,1,0,1,Spirit_Airlines
74,1234937404101922822,/KyraBrigh/status/1234937404101922822,2020-03-03 15:23:15,This gotta be spirit airlines,0,2621531602,KyraBrigh,2,1,0,1,0,1,Spirit_Airlines
75,1234941305668526080,/IzuRichiee_/status/1234941305668526080,2020-03-03 15:38:46,Mustve been spirit airlines https://twitter.com/gnuman1979/status/1234678426415456260,0,1043977411,IzuRichiee_,0,1,0,0,0,1,Spirit_Airlines
76,1234944235713040388,/OhMrWilson314/status/1234944235713040388,2020-03-03 15:50:24,Idk why this is hilarious but it sure is ..... vouchers for everyone unless this is spirit airlines https://twitter.com/gnuman1979/status/1234678426415456260,0,138813633,OhMrWilson314,0,0,0,0,0,1,Spirit_Airlines
77,1234944551527309313,/dany_dos1/status/1234944551527309313,2020-03-03 15:51:39,Spirit Airlines https://twitter.com/gnuman1979/status/1234678426415456260,0,772653326,dany_dos1,0,6,0,0,0,1,Spirit_Airlines
78,1234947916374192128,/kahtikahti/status/1234947916374192128,2020-03-03 16:05:02,"and finally, all the children in the back of the plane screamed like they were on a rollercoaster every time we hit turbulence. God bless spirit airlines",0,32602457,kahtikahti,0,2,0,0,0,1,Spirit_Airlines
79,1234948225817288716,/BlasianBytch/status/1234948225817288716,2020-03-03 16:06:15,I was supposed to listen to Panic! At the Disco all day but I'm reading political shit and yelling at Spirit Airlines,0,49390479,BlasianBytch,1,2,0,0,0,1,Spirit_Airlines
80,1234948636640976896,/itscharimonet/status/1234948636640976896,2020-03-03 16:07:53,This has to be spirit airlines ... https://twitter.com/gnuman1979/status/1234678426415456260,0,149616956,itscharimonet,0,2,1,0,0,1,Spirit_Airlines
81,1234952722668933121,/BriskBoy_EJ/status/1234952722668933121,2020-03-03 16:24:08,Must be spirit airlines https://twitter.com/gnuman1979/status/1234678426415456260,0,385754235,BriskBoy_EJ,0,2,0,0,0,1,Spirit_Airlines
82,1234955772896972800,/_Jxylen/status/1234955772896972800,2020-03-03 16:36:15,Spirit airlines going crazy https://twitter.com/gnuman1979/status/1234678426415456260,0,2832960153,_Jxylen,0,3,0,0,0,1,Spirit_Airlines
83,1234957145088692230,/princecorleone0/status/1234957145088692230,2020-03-03 16:41:42,looks like spirit airlines https://twitter.com/gnuman1979/status/1234678426415456260,0,4784810809,princecorleone0,0,0,0,0,0,1,Spirit_Airlines
84,1234959627592380417,/nola411/status/1234959627592380417,2020-03-03 16:51:34,"Spirit Airlines makes it easier to get away internationally from NOLA [ Local Stories] https://ift.tt/2uOXUwj #NOLA Local Stories, WDSU",0,47079250,nola411,0,0,0,0,0,1,Spirit_Airlines
85,1234961750518157313,/JoinFlyline/status/1234961750518157313,2020-03-03 17:00:00,FlyLine Deal:  Round-trip flight on Spirit Airlines from Denver to Austin for just $61.00 on 03/07 -> 03/10! Visit http://joinflyline.com and book it #FlyLine #Travel #Wanderlust #Trip #TravelTheWorld,0,1192134402098237444,JoinFlyline,0,0,0,0,0,1,Spirit_Airlines
86,1234964018336419841,/SinatraBoss80/status/1234964018336419841,2020-03-03 17:09:01,"Spirit Airlines season ticket holder, Mark Davis!",0,147801045,SinatraBoss80,0,3,0,1,0,1,Spirit_Airlines
87,1234970406567591936,/JayyyyyBaby/status/1234970406567591936,2020-03-03 17:34:24,Thank You For Flying With Spirit Airlines https://twitter.com/TheKalenAllen/status/1234956352918671360,0,2960378196,JayyyyyBaby,0,0,0,0,0,1,Spirit_Airlines
88,1234970458748928002,/JoelAtTheDisco/status/1234970458748928002,2020-03-03 17:34:36,"Sorry for the minor turbulence, anyway, thank you for flying Spirit Airlines! https://twitter.com/gnuman1979/status/1234678426415456260",0,355146920,JoelAtTheDisco,1,9,3,0,0,1,Spirit_Airlines
89,1234976484294397952,/svcxl/status/1234976484294397952,2020-03-03 17:58:33,Spirit airlines be like https://twitter.com/gnuman1979/status/1234678426415456260,0,382414848,svcxl,1,10,4,0,0,1,Spirit_Airlines
90,1234976555807301632,/OhMrWilson314/status/1234976555807301632,2020-03-03 17:58:50,Sign you up for a Spirit Airlines First class flight to hell https://twitter.com/Mar5hletic/status/1234975080087576576,0,138813633,OhMrWilson314,1,0,0,0,0,1,Spirit_Airlines
91,1234976966953992195,/jlb21/status/1234976966953992195,2020-03-03 18:00:28,"Spirit Airlines Expands Internationally in New Orleans, Offers Airports Only Nonstop Flight to Honduras

http://ow.ly/GR9r50yBFmw",0,14801343,jlb21,1,1,0,0,0,1,Spirit_Airlines
